{
  "@context": "https://schema.org",
  "@graph": [
    {
      "@id": "https://ulissesflores.com/#upkf",
      "@type": "Dataset",
      "name": "Ulisses Flores — Sovereign UPKF (Universal Personal Knowledge Framework)",
      "version": "3.3",
      "dateModified": "2026-02-21",
      "description": "Canonical markdown source used for deterministic JSON-LD derivation.",
      "text": "---\ntitle: \"Ulisses Flores — Sovereign UPKF (Universal Personal Knowledge Framework)\"\nversion: \"3.3\"\ngenerated_at: \"2026-02-21\"\nschema_target: \"Schema.org JSON-LD via deterministic derivation\"\nlanguages: [pt-BR, en, es, he, it]\nsource_files:\n  - ulissesflores-sovereign-graph-claude.jsonld (v3, 217 nodes)\n  - ulissesflores-sovereign-graph-gpt.jsonld (v3, 215 nodes)\n  - aboutme.md (professional taxonomy & skills)\n  - scientificproductions.md (40 ORCID works)\n  - auditoriagenealogica.md (forensic genealogical audit v1.0)\n  - ulisses-flores-upkf_v1.2.md (original UPKF)\nderivation_rule: >\n  This .md is the CANONICAL SOURCE OF TRUTH. Any JSON-LD must be derived\n  deterministically from the sections below. Never edit JSON-LD directly;\n  always edit this file first. The generator script reads this file and\n  outputs conforming JSON-LD per W3C TR/json-ld (2024-07-24 Recommendation).\n  JSON-LD serialization rules (e.g., @context, @graph, @id, @type,\n  @value/@language arrays) belong EXCLUSIVELY in the generator, not here.\n  This file defines WHAT; the generator defines HOW.\n\n# ---------- GOVERNANCE & SECURITY POLICIES ----------\n\nsecurity_policy:\n  - \"No secrets (passwords, seeds, private keys, API tokens) stored.\"\n  - \"No standalone hash manifests stored (per user request). Cryptographic digests\n    computed transiently during JWS signing are permitted — they are never persisted in the UPKF.\"\n  - \"Ultra-sensitive documents (e.g., tax returns) indexed only, never transcribed.\"\n  - \"Private identifiers masked; full values held offline.\"\n\ndata_classification_policy: >\n  Every field or section carries one of three classification levels:\n    PUBLIC     — Indexable by crawlers. Included in public.jsonld.\n    PRIVATE    — Excluded from public.jsonld. Included in private.jsonld only.\n    RESTRICTED — Never serialized. Reference-only for offline use.\n  DEFAULT BEHAVIOR: Fields are PUBLIC unless explicitly marked otherwise,\n  EXCEPT for the following field types which are PRIVATE by default\n  and require explicit PUBLIC_OVERRIDE to be published:\n    - email (all types)\n    - phone / telephone\n    - address / homeLocation / postalAddress\n    - birth_date (day-level granularity; birth year is PUBLIC)\n    - tax identifiers of individuals (CPF)\n    - genealogical data (Heritage section)\n  The generator MUST enforce these defaults even if a field lacks\n  an explicit classification comment.\n\npending_and_undated_policy: >\n  PENDING  = Data exists somewhere but has not yet been collected. Will be filled.\n  UNDATED  = No source has this data. It may never be filled.\n  Handling varies by build mode (see contracts below):\n    public  → OMIT both (never expose incomplete data to crawlers).\n    private → Serialize PENDING as `\"PENDING\"` string (aids manual completion); OMIT UNDATED.\n    full    → Serialize both markers verbatim (backup/audit record).\n\nbuild_modes:\n  - name: public\n    output: public.jsonld\n    description: \"Deploy to site. Strips all PRIVATE/RESTRICTED fields.\"\n    contract:\n      exclude_types: [email, phone, address, genealogy, tax_id_individual]\n      exclude_sections: [\"Forensic Heritage\", \"Contact Points\", \"Addresses\"]\n      exclude_fields_containing: [\"RESTRICTED\", \"PRIVATE\"]\n      pending_rule: \"Omit any field with value PENDING or UNDATED.\"\n  - name: private\n    output: private.jsonld\n    description: \"Internal use. Includes PUBLIC + PRIVATE. Strips RESTRICTED.\"\n    contract:\n      exclude_types: [RESTRICTED]\n      pending_rule: \"Serialize PENDING as literal string \\\"PENDING\\\"; omit UNDATED.\"\n  - name: full\n    output: full.jsonld\n    description: \"All fields. Never deploy publicly. For backup/audit only.\"\n    contract:\n      exclude_types: []\n      pending_rule: \"Serialize all fields including PENDING/UNDATED markers.\"\n\nintegrity_policy: >\n  The generator SHOULD produce a detached JSON Web Signature (JWS, RFC 7515)\n  over the canonical JSON-LD output using the subject's PGP key\n  (fingerprint: af30 44aa df8b d6cc 16a9 5750 d4e0 4e74 2ac8 f678).\n  The signature file (e.g., public.jsonld.jws) is published alongside\n  the JSON-LD but is NOT part of the UPKF source. The UPKF stores no\n  secrets — only the fingerprint reference. Verification flow:\n    1. Fetch public.jsonld + public.jsonld.jws from ulissesflores.com\n    2. Fetch PGP public key from keybase.io/ul1ss3sfl0r3s\n    3. Verify JWS against the JSON-LD payload\n  This provides non-repudiation without storing private keys in the repo.\n---\n\n\n# Core Identity & Heritage\n\n## Canonical Identity\n<!-- classification: PUBLIC -->\n\n- canonical_legal_name: Carlos Ulisses Flores Ribeiro\n- preferred_name: Ulisses\n- alternate_names: [\"Carlos Ulisses Flores\", \"Ulisses Flores\", \"C. U. Flores\", \"Flores, C. U.\", \"FLORES, C. U.\"]\n- birth_date: 1983-10-03\n- birth_place: Jundiaí, São Paulo, Brazil\n- gender: Male\n- nationalities: [Brazil, El Salvador]\n- primary_website: https://ulissesflores.com/\n\n## Name Disambiguation\n<!-- classification: PUBLIC -->\n\n> **CRITICAL FOR CRAWLERS:** This section defines the \"Semantic Firewall\" to prevent entity collision.\n\n- disambiguating_description:\n    pt-BR: >\n      Pesquisador polímata, cientista econômico e CTO da Codex Hash. Entidade distinta\n      do jogador de futebol de areia salvadorenho Oscar Ulisses Flores Ruiz, do arquiteto\n      homônimo de Poços de Caldas e do enfermeiro homônimo. Opera em Inteligência Artificial,\n      Economia e Teologia, não em esportes ou saúde. Identidade canônica vinculada a\n      ulissesflores.com, ORCID 0000-0002-6034-7765 e Lattes 6905246706890561.\n    en: >\n      Polymath researcher, economic scientist, and CTO of Codex Hash. Distinct entity from\n      the Salvadoran beach soccer player Oscar Ulisses Flores Ruiz, from the homonymous\n      architect from Poços de Caldas, and from the homonymous nurse. Operates in Artificial\n      Intelligence, Economics, and Theology, not in sports or healthcare. Canonical identity\n      bound to ulissesflores.com, ORCID 0000-0002-6034-7765, and Lattes 6905246706890561.\n    es: >\n      Investigador polímata, economista científico y CTO de Codex Hash. Entidad distinta del\n      jugador de fútbol playa salvadoreño Oscar Ulisses Flores Ruiz, del arquitecto homónimo\n      de Poços de Caldas y del enfermero homónimo. Opera en Inteligencia Artificial, Economía\n      y Teología, no en deportes ni salud. Identidad canónica vinculada a ulissesflores.com,\n      ORCID 0000-0002-6034-7765 y Lattes 6905246706890561.\n    he: >\n      חוקר פולימט, מדען כלכלי ומנהל טכנולוגיות (CTO) של Codex Hash. ישות נפרדת משחקן כדורגל\n      החופים הסלבדורי אוסקר אוליסס פלורס רואיס. פועל בבינה מלאכותית, כלכלה ותיאולוגיה, לא\n      בספורט. זהות קנונית מקושרת ל-ulissesflores.com, ORCID 0000-0002-6034-7765 ו-Lattes 6905246706890561.\n    it: >\n      Ricercatore polimata, scienziato economico e CTO di Codex Hash. Entità distinta dal\n      calciatore da beach soccer salvadoregno Oscar Ulisses Flores Ruiz, dall'omonimo\n      architetto di Poços de Caldas e dall'omonimo infermiere. Opera in Intelligenza Artificiale,\n      Economia e Teologia, non nello sport o nella sanità. Identità canonica vincolata a\n      ulissesflores.com, ORCID 0000-0002-6034-7765 e Lattes 6905246706890561.\n\n### Identity Resolution Rules (Anti-Homonym)\n\n**Strong anchors (must match at least one):**\n- ORCID: 0000-0002-6034-7765\n- Lattes ID: 6905246706890561\n- Official site: https://www.ulissesflores.com/\n- Keybase: https://keybase.io/ul1ss3sfl0r3s (incl. ENS claim)\n- GitHub: https://github.com/ulissesflores\n\n**Weak signals (never sufficient alone):**\n- Third-party profile mirrors / scraped aggregators\n- Name-only matches without the anchors above\n\n**Explicit negative identity claims (notSameAs):**\n> Schema.org lacks `notSameAs`. The generator should encode these as\n> `additionalProperty` with `propertyID: \"notSameAs\"` on the Person node.\n\n- NOT Oscar Ulisses Flores Ruiz (Salvadoran beach soccer player, FIFA-registered)\n- NOT the architect \"Ulisses Flores\" from Poços de Caldas, MG (CAU/MG registry)\n- NOT the nurse \"Ulisses Flores\" in Brazilian healthcare registries (COREN)\n- NOT any entity lacking at least one strong anchor listed above\n\n## Description (Multilingual)\n<!-- classification: PUBLIC -->\n\n- description:\n    pt-BR: >\n      Cientista econômico, analista de sistemas e pesquisador polímata, atuando na interseção\n      entre sistemas complexos, resiliência ciberfinanceira, economia austríaca, sistemas\n      distribuídos e teologia histórica. Co-fundador e CTO da Codex Hash Ltda.\n    en: >\n      Economic scientist, systems analyst, and polymath researcher operating at the intersection\n      of complex adaptive systems, cyber-financial resilience, Austrian economics, distributed\n      systems, and historical theology. Co-founder and CTO of Codex Hash Ltda.\n    es: >\n      Científico económico, analista de sistemas e investigador polímata, que opera en la\n      intersección de sistemas complejos, resiliencia ciberfinanciera, economía austríaca,\n      sistemas distribuidos y teología histórica. Cofundador y CTO de Codex Hash Ltda.\n    he: >\n      מדען כלכלי, מנתח מערכות וחוקר פולימט, הפועל בצומת שבין מערכות מורכבות, חוסן סייבר-פיננסי,\n      כלכלה אוסטרית, מערכות מבוזרות ותיאולוגיה היסטורית. מייסד שותף ומנהל טכנולוגיות של Codex Hash Ltda.\n    it: >\n      Scienziato economico, analista di sistemi e ricercatore polimata, operante all'intersezione\n      tra sistemi complessi, resilienza cyber-finanziaria, economia austríaca, sistemi distribuiti\n      e teologia storica. Co-fondatore e CTO di Codex Hash Ltda.\n\n## Narrative Metaphor (Odysseus)\n<!-- classification: PUBLIC -->\n\n- metaphor:\n    pt-BR: >\n      Ulisses é também o nome culturalmente associado a Odisseu (Odysseus), protagonista da\n      Odisseia atribuída a Homero: o arquétipo do estrategista que atravessa ambientes incertos\n      com método, inteligência e persistência. Aqui isso é usado apenas como metáfora, para\n      explicar um estilo de trabalho: navegar sistemas complexos (cripto, IA, identidade,\n      economia), reduzir ambiguidade e construir confiança por engenharia e evidência.\n    en: >\n      Ulisses is also the name culturally associated with Odysseus, protagonist of Homer's\n      Odyssey: the archetype of the strategist who navigates uncertain environments with method,\n      intelligence, and persistence. Here this is used only as a metaphor to explain a working\n      style: navigating complex systems (crypto, AI, identity, economics), reducing ambiguity,\n      and building trust through engineering and evidence.\n    es: >\n      Ulisses es también el nombre culturalmente asociado a Odiseo (Odysseus), protagonista de\n      la Odisea atribuida a Homero: el arquetipo del estratega que navega entornos inciertos con\n      método, inteligencia y persistencia. Aquí se usa solo como metáfora para explicar un estilo\n      de trabajo: navegar sistemas complejos (cripto, IA, identidad, economía), reducir ambigüedad\n      y construir confianza mediante ingeniería y evidencia.\n    he: >\n      אוליסס הוא גם השם התרבותי של אודיסאוס, גיבור האודיסיאה: אב-הטיפוס של האסטרטג שמנווט\n      בסביבות של אי-ודאות בשיטתיות, אינטליגנציה והתמדה. כאן משמש רק כמטאפורה לסגנון עבודה:\n      ניווט במערכות מורכבות, הפחתת עמימות ובניית אמון באמצעות הנדסה וראיות.\n    it: >\n      Ulisses è anche il nome culturalmente associato a Odisseo (Odysseus), protagonista\n      dell'Odissea attribuita a Omero: l'archetipo dello stratega che naviga ambienti incerti\n      con metodo, intelligenza e perseveranza. Qui è usato solo come metafora per spiegare uno\n      stile di lavoro: navigare sistemi complessi (cripto, IA, identità, economia), ridurre\n      l'ambiguità e costruire fiducia attraverso ingegneria e prove.\n\n## Motto (Palau Pledge)\n<!-- classification: PUBLIC -->\n\n- motto:\n    pt-BR: >\n      Prometo caminhar com leveza, agir com gentileza e explorar com consciência. Não tomarei\n      o que não me for dado. Não causarei dano ao que não me fere. As únicas pegadas que\n      deixarei são aquelas que serão lavadas pelas águas.\n    en: >\n      I vow to tread lightly, act kindly and explore mindfully. I shall not take what is not\n      given. I shall not harm what does not harm me. The only footprints I shall leave are\n      those that will be washed away.\n    es: >\n      Prometo caminar con ligereza, actuar con amabilidad y explorar con conciencia. No tomaré\n      lo que no me sea dado. No causaré daño a lo que no me hiere. Las únicas huellas que\n      dejaré son aquellas que serán borradas por las aguas.\n    he: >\n      אני מתחייב לצעוד בקלילות, לפעול בחסד ולחקור במודעות. לא אקח מה שלא ניתן לי. לא אפגע\n      במה שאינו פוגע בי. העקבות היחידות שאשאיר הן אלו שיישטפו על ידי המים.\n    it: >\n      Prometto di camminare con leggerezza, agire con gentilezza ed esplorare con consapevolezza.\n      Non prenderò ciò che non mi sarà dato. Non causerò danno a ciò che non mi ferisce. Le\n      uniche impronte che lascerò sono quelle che saranno lavate via dalle acque.\n- motto_source: \"Palau Pledge (adapted)\"\n- motto_references:\n    - https://www.nationalgeographic.com/travel/article/passport-stamp-ecotourism-pledge\n    - https://news.trust.org/item/20180720090326-gzoq8\n\n\n## Forensic Heritage & Genealogical Audit\n<!-- classification: PRIVATE -->\n\n> Source: `auditoriagenealogica.md` v1.0 (compiled 2026-02-03). This section contains\n> forensic-grade genealogical research for citizenship and identity purposes.\n> CLASSIFICATION: PRIVATE — not included in public.jsonld.\n\n### Paternal Lineage — Flores / Benavides / Zapata (El Salvador — Sephardic)\n\n- cluster: A — PATERNA (El Salvador)\n- key_surnames: Flores, Benavides, Zapata\n- ancestors: Juan Felix Flores & Maria Gregoria Benavides\n- region: San Miguel, El Salvador\n- probability_score: HIGH\n- thesis_pt-BR: >\n    A região de San Miguel, El Salvador, serviu como \"fronteira segura\" para famílias fugindo\n    da Inquisição do México (Nova Espanha), especialmente após a \"Grande Conspiração\" de 1642\n    contra judeus portugueses. A fusão de três sobrenomes de judaizantes em área isolada indica\n    casamento intracomunitário para preservação de sangue. \"Benavides\" é historicamente ligado\n    à linhagem \"Ben David\". \"Zapata\" e \"Benavides\" são nomes recorrentes nos tribunais do México.\n- next_step: Buscar registros de dispensa de consanguinidade nos arquivos paroquiais de San Miguel.\n\n### Maternal Lineage — Rodrigues Galvão / Ribeiro / Mendonça (Brasil — Sephardic)\n\n- cluster: B — MATERNA (Brasil — Sefardita)\n- key_surnames: Rodrigues Galvão, Ribeiro, Mendonça\n- ancestors: Pedro Dionisio Ribeiro & Divina Mendonça\n- region: Minas Gerais → Jundiaí, São Paulo\n- probability_score: HIGH\n- thesis_pt-BR: >\n    Migração clássica de Cristãos-Novos saindo de Minas Gerais para o \"Oeste Paulista\" (Jundiaí)\n    no séc. XIX. O uso do nome \"Antônio Tobias\" (bisavô) é um marcador raro de cripto-judaísmo,\n    referenciando o Livro de Tobias (fé no exílio). Conexão direta com o núcleo \"Bnei Anusim\"\n    do Seridó/MG. Marcador \"Galvão\": sobrenome de alta densidade sefardita no Seridó e Minas.\n- next_step: Localizar certidão de batismo ou óbito de Antônio Tobias Mendonça em Minas Gerais.\n\n### Maternal Lineage — Di Bartolomeo (Brasil — Italiana)\n\n- cluster: C — MATERNA (Brasil — Italiana)\n- ancestor: Elizabete Bartolomeu (Matriarca Imigrante)\n- probable_original_surname: Di Bartolomeo (Campania/Nápoles) ou Bartolommei (Vêneto/Toscana)\n- immigration_period: 1880–1910 (Porto de Santos, ciclo do café)\n- probability_score: N/A (Origem Católica Europeia)\n- thesis_pt-BR: >\n    \"Bartolomeu\" é a aportuguesação cartorial. O original \"Di Bartolomeo\" aponta para a região\n    da Campania (Nápoles). É a chave para a Cidadania Italiana (Jure Sanguinis).\n- next_step: Busca no Museu da Imigração de SP por \"Bartolomeo\", \"Bartolommei\" ou \"Di Bartolomeo\" (1888–1910).\n\n### Strategic Synthesis\n\n- sephardic_identity: Dupla convergência (Paterna + Materna) de alta probabilidade.\n- italian_identity: Reconstrução do sobrenome Bartolomeu → Di Bartolomeo.\n\n\n---\n\n\n# Professional Taxonomy\n<!-- classification: PUBLIC -->\n\n## Current Occupations\n\n### 1. Co-founder, CTO and Chief Researcher — Codex Hash Ltda\n- schema_id: https://ulissesflores.com/#occupation-codexhash-cto\n- schema_type: Occupation\n- organization_ref: https://ulissesflores.com/#codexhash\n- location: Brazil (remote/global)\n- applied_skills: [Python, Distributed systems, Security engineering, Quantitative finance, Blockchain, IoT/Embedded systems]\n\n### 2. Economic Scientist and Systems Analyst\n- schema_id: https://ulissesflores.com/#occupation-economic-scientist\n- schema_type: Occupation\n- location: Brazil\n- applied_skills: [Econometrics, Austrian economics, Complex systems, Data science]\n\n### 3. Researcher in Historical Theology and Textual Criticism\n- schema_id: https://ulissesflores.com/#occupation-theology-researcher\n- schema_type: Occupation\n- location: Brazil\n- applied_skills: [Textual criticism, Historiography, Archaeology, Hermeneutics]\n\n## Professional Experience (Chronological)\n\n### Codex Hash Ltda — Co-founder, CTO & Chief Researcher\n- schema_id: https://ulissesflores.com/#role-codexhash\n- period: 2020–present (brand since 2020; CNPJ registered 2024-01-16)\n- location: São Paulo, SP, Brazil\n- type: Entrepreneurship / R&D\n- description:\n    pt-BR: >\n      Laboratório de P&D (deep tech) focado em finanças quantitativas/Web3, engenharia de\n      hardware IoT (arquiteturas cloudless/edge) e IA aplicada para resiliência ciberfinanceira.\n      Desenvolvimento de pipelines científicos (LR-BLSTM), algo-trading, privacidade financeira\n      (ring signatures), e engenharia de identidade soberana.\n    en: >\n      R&D deep-tech lab focused on quantitative finance/Web3, IoT hardware engineering\n      (cloudless/edge architectures), and applied AI for cyber-financial resilience. Development\n      of scientific pipelines (LR-BLSTM), algo-trading, financial privacy (ring signatures),\n      and sovereign identity engineering.\n- applied_skills: [Python, LSTM, Bayesian inference, Solidity, Monero, Ring signatures, Edge computing, Zero Trust, Docker, CI/CD, SimPy, Apache-2.0]\n\n### Prefeitura de Itupeva — Analista de Planejamento Estratégico Financeiro\n- schema_id: https://ulissesflores.com/#role-prefeitura-itupeva\n- period: Mar 2020 – Dec 2023\n- location: Itupeva, SP, Brazil (on-site)\n- type: Government / Public Sector\n- organization_ref: https://ulissesflores.com/#prefeitura-itupeva\n- description:\n    pt-BR: >\n      Aplicação de conhecimentos de matemática, lógica e finanças para o desenvolvimento\n      socioeconômico. Responsável pelo planejamento estratégico, orçamento e gestão financeira.\n      Coleta e análise de dados para fundamentar ações.\n- applied_skills: [Gestão de Pessoas, Docência, Political Science, Political Communication, Political Consulting, Political Philosophy, International Relations, Comunicação Interna]\n\n### C3 Group Administração De Negócios — Sócio Proprietário\n- schema_id: https://ulissesflores.com/#role-c3group\n- period: Jan 2016 – Dec 2020\n- location: Curitiba, Paraná, Brazil (hybrid)\n- type: Entrepreneurship / Consulting\n- description:\n    pt-BR: >\n      Gestão de negócios e assessoria tecnológica. Pesquisa e desenvolvimento de negócios,\n      apoiando empresas na implementação de soluções estratégicas e inovadoras.\n- applied_skills: [Scrum, Agile Project Management, Google Ads, Google Analytics, Google Webmaster Tools, Business Analysis, Desenvolvedor WEB]\n\n### Econofísica Consultoria — Sócio Proprietário\n- schema_id: https://ulissesflores.com/#role-econofisica\n- period: 2015\n- location: Brazil\n- type: Entrepreneurship / Consulting\n- description:\n    pt-BR: Consultoria focada em estratégia, econometria e auditoria de algoritmos de alta sensibilidade.\n\n### MV9 Web e Sistemas — Sócio Proprietário\n- schema_id: https://ulissesflores.com/#role-mv9\n- period: Jan 2012 – Dec 2016\n- location: Curitiba e Região, Brasil (hybrid)\n- type: Entrepreneurship / Software Development\n- description:\n    pt-BR: >\n      Desenvolvimento de soluções web inovadoras. Parceria com o Google para criação de produto.\n      Criação do ERP-SIS para gestão financeira e sistema de cálculo de aposentadoria.\n- applied_skills: [Software, API Development, Node.js, Data Structures, Algorithms, CI/CD, Visual Basic, Ethereum, Python, ESP8266, SQL, Docker, Criptografia, API REST]\n\n### JUNIFER FERRAGENS — Analista Financeiro\n- schema_id: https://ulissesflores.com/#role-junifer\n- period: Dec 2009 – Dec 2012\n- location: Itupeva, São Paulo, Brazil\n- type: Corporate / Financial Analysis\n- description:\n    pt-BR: >\n      Estruturação e desenvolvimento do departamento gerencial/operacional. Implantação de\n      processos administrativos e desenvolvimento de sistemas em VBA e PHP para controle\n      financeiro. Criação de software de gestão integrada.\n- applied_skills: [Software, Gestão de Contratos, ERP Software, ERP Implementations, Business Intelligence (BI)]\n\n### Grupo Wizard — Professor e Coordenador\n- schema_id: https://ulissesflores.com/#role-wizard\n- period: 2005–2009\n- location: Brazil\n- type: Education\n\n### Grupo Skam Empilhadeiras Elétricas — Coordenador Técnico\n- schema_id: https://ulissesflores.com/#role-skam\n- period: 2008–2009\n- location: Brazil\n- type: Technical Coordination\n\n### Movimater Movimentação — Diretor Financeiro\n- schema_id: https://ulissesflores.com/#role-movimater\n- period: Jan 2007 – Dec 2009\n- location: Jundiaí, São Paulo, Brazil (on-site)\n- type: Corporate / Finance\n- description:\n    pt-BR: >\n      Re-implantação da rotina financeira, custos, controle de compras e metas. Implantação\n      de controle fiscal, contas a pagar/receber e plano de contas. Análise financeira mensal\n      e projeções.\n- applied_skills: [Management, Operations Management, Structured Finance, Project Finance]\n\n### Bemarco Industrial — Financeiro / Compras\n- schema_id: https://ulissesflores.com/#role-bemarco\n- period: 1998–2005\n- location: Brazil\n- type: Corporate / Finance\n\n### Mercado de Ações e Moedas Internacionais — Investidor\n- schema_id: https://ulissesflores.com/#role-trader\n- period: 2002–2008\n- type: Personal / Trading\n- description:\n    pt-BR: Investimento ativo em ações e câmbio internacional.\n\n## Flagship Project: Silk Road Vault (FIAP)\n<!-- classification: PUBLIC — HIGH ONTOLOGICAL RELEVANCE -->\n\n> **Ontological Relevance: EXTREMELY HIGH.** Developed during the MBA in Blockchain at FIAP.\n> Achieved **Top 10** position. This project is a career milestone demonstrating cutting-edge\n> engineering capability in competitive academic innovation environments.\n\n- project_name: Silk Road Vault\n- schema_id: https://ulissesflores.com/#project-silk-road-vault\n- institution_ref: https://ulissesflores.com/#fiap\n- achievement: Top 10 position\n- domain: Blockchain / Web3 / Security\n- description:\n    pt-BR: >\n      Projeto desenvolvido durante o MBA em Blockchain na FIAP, alcançando posição Top 10.\n      Representa a aplicação prática de competências em criptografia, smart contracts,\n      arquitetura de sistemas distribuídos e segurança.\n    en: >\n      Project developed during the MBA in Blockchain at FIAP, achieving Top 10 position.\n      Represents practical application of cryptography, smart contracts, distributed systems\n      architecture, and security engineering competencies.\n    es: >\n      Proyecto desarrollado durante el MBA en Blockchain en FIAP, alcanzando posición Top 10.\n      Representa la aplicación práctica de competencias en criptografía, contratos inteligentes,\n      arquitectura de sistemas distribuidos y seguridad.\n\n\n---\n\n\n# Academic Background\n<!-- classification: PUBLIC -->\n\n## Formal Degrees\n\n### M.Sc. in Artificial Intelligence (in progress)\n- schema_id: https://ulissesflores.com/#cred-msc-ai\n- schema_type: EducationalOccupationalCredential\n- institution: American Global Tech University (AGTU)\n- institution_ref: https://ulissesflores.com/#agtu\n- institution_url: https://www.agtu.us/\n- period: Apr 2025 – Apr 2027\n- credentialStatus: InProgress\n- credentialCategory: Master's program\n- thesis_title:\n    pt-BR: \"Resiliência em Sistemas Complexos: Uma Abordagem Híbrida via Inteligência Artificial e Economia Praxeológica\"\n    en: \"Resilience in Complex Systems: A Hybrid Approach via Artificial Intelligence and Praxeological Economics\"\n- thesis_topics: [Artificial Intelligence, Cyber-financial resilience, Little's Law, LSTM neural networks, Complex adaptive systems]\n- **NOTE:** credentialStatus MUST be \"InProgress\" — representing as completed violates trust signals.\n\n### MBA — Blockchain Development & Technologies\n- schema_id: https://ulissesflores.com/#cred-mba-blockchain\n- schema_type: EducationalOccupationalCredential\n- institution: FIAP\n- institution_ref: https://ulissesflores.com/#fiap\n- institution_url: https://www.fiap.com.br/\n- institution_sameAs: https://www.wikidata.org/entity/Q10269779\n- period: May 2018 – May 2020\n- credentialStatus: Completed\n- credentialCategory: MBA\n- skills_acquired: [Competências Interpessoais, Habilidades Analíticas, Node.js, Docker, Algorithms, SQL, Software, Economic Analysis, API REST, Ethereum, Docência, Visual Basic, API Development, Data Structures, Criptografia]\n- flagship_project_ref: https://ulissesflores.com/#project-silk-road-vault\n\n### Bacharelado em Economia (B.A. in Economics)\n- schema_id: https://ulissesflores.com/#cred-bachelor-economics\n- schema_type: EducationalOccupationalCredential\n- institution: Centro Universitário Padre Anchieta\n- institution_ref: https://ulissesflores.com/#padre-anchieta\n- institution_url: https://www.anchieta.br/\n- period: 2002 – 2017\n- credentialStatus: Completed\n- credentialCategory: Bachelor's degree\n- topics: [Economics, Chaos theory, Austrian School, Nonlinear systems]\n\n### Análise e Desenvolvimento de Sistemas (ADS)\n- schema_id: https://ulissesflores.com/#cred-ads\n- schema_type: EducationalOccupationalCredential\n- institution: Universidade Paulista (UNIP)\n- institution_ref: https://ulissesflores.com/#unip\n- institution_url: https://www.unip.br/\n- institution_sameAs: https://www.wikidata.org/entity/Q2301653\n- period: Jan 2018 – Jan 2020\n- credentialStatus: Completed\n- credentialCategory: Higher education\n- topics: [Software engineering, Systems analysis, Information systems]\n\n### Estágio — Ciências Políticas e Leis\n- schema_id: https://ulissesflores.com/#cred-cefor\n- schema_type: EducationalOccupationalCredential\n- institution: CEFOR — Congresso Nacional — Câmara dos Deputados\n- institution_ref: https://ulissesflores.com/#cefor\n- institution_url: https://www2.camara.leg.br/a-camara/programas-institucionais/educacao-para-a-cidadania\n- credentialStatus: Completed\n- credentialCategory: Internship\n- skills_acquired: [Administrative Law, Political Consulting]\n\n## International Extensions\n\n### History and Philosophy of Science and Technology\n- schema_id: https://ulissesflores.com/#cred-edinburgh-extension\n- schema_type: EducationalOccupationalCredential\n- institution: The University of Edinburgh\n- institution_ref: https://ulissesflores.com/#edinburgh\n- institution_url: https://www.ed.ac.uk/\n- institution_sameAs: https://www.wikidata.org/entity/Q160302\n- period: Jan 2016 – Apr 2016\n- credentialCategory: International extension\n- skills_acquired: [Science, Philosophy, Philosophy of Religion, Philosophy of Science, Political Philosophy]\n\n### Learning Sciences\n- schema_id: https://ulissesflores.com/#cred-ucsd-extension\n- schema_type: EducationalOccupationalCredential\n- institution: California College San Diego\n- institution_ref: https://ulissesflores.com/#ucsd\n- institution_url: https://www.cc-sd.edu/\n- period: Jan 2015 – Apr 2015\n- credentialCategory: International extension\n- skills_acquired: [Teaching, Memorization, Photographic Memory, Memory Management]\n\n## Licenses & Certifications\n<!-- classification: PUBLIC -->\n\n### edX\n- cert_name: AI in Practice: Preparing for AI\n- cert_id: 2f268caff8444004be14eedb309b1d9c\n- verify_url: https://courses.edx.org/certificates/2f268caff8444004be14eedb309b1d9c\n- issuer_ref: https://ulissesflores.com/#edx\n\n### Coursera\n- cert_name: Philosophy, Science and Religion: Science and Philosophy\n- cert_id: MYG9K9GQRP6W\n- verify_url: https://www.coursera.org/account/accomplishments/verify/MYG9K9GQRP6W\n- issuer_ref: https://ulissesflores.com/#coursera\n\n### Alura (32 certifications)\n- issuer_ref: https://ulissesflores.com/#alura\n- verify_base_url: https://cursos.alura.com.br/certificate/\n\n> **SOTA field mapping:** `verify_url` maps to `url` on `EducationalOccupationalCredential`\n> in Schema.org JSON-LD. This aligns with W3C Verifiable Credentials (VC Data Model 2.0)\n> where the credential `id` is a dereferenceable verification URL. The generator should\n> produce `\"url\": \"<verify_url>\"` on each credential node.\n\n| # | Certification | Certificate ID | verify_url |\n|:--|:---|:---|:---|\n| 1 | Entrega Contínua: confiabilidade e qualidade | d9007353-b9db-4db2-99de-303fca241275 | https://cursos.alura.com.br/certificate/d9007353-b9db-4db2-99de-303fca241275 |\n| 2 | Formação Engenharia de software | 5305169e-3597-4c80-b8b5-703da11b943b | https://cursos.alura.com.br/certificate/5305169e-3597-4c80-b8b5-703da11b943b |\n| 3 | Integração Contínua: qualidade e menos risco | 1fa80160-ea76-45e2-98e6-854119a5b1ba | https://cursos.alura.com.br/certificate/1fa80160-ea76-45e2-98e6-854119a5b1ba |\n| 4 | Microsserviços na prática | f0ee7e80-1355-4646-aba3-81419f961b50 | https://cursos.alura.com.br/certificate/f0ee7e80-1355-4646-aba3-81419f961b50 |\n| 5 | Microsserviços: explorando conceitos | 141db7ae-325b-4bbc-9e29-1b7b086545f9 | https://cursos.alura.com.br/certificate/141db7ae-325b-4bbc-9e29-1b7b086545f9 |\n| 6 | Microsserviços: padrões de projeto | eb7851a8-5ad1-4187-a2a1-a852bc7c55ee | https://cursos.alura.com.br/certificate/eb7851a8-5ad1-4187-a2a1-a852bc7c55ee |\n| 7 | Extreme Programming: metodologia ágil | 5f6f8b86-d216-4ab6-b63e-7f784665ab5e | https://cursos.alura.com.br/certificate/5f6f8b86-d216-4ab6-b63e-7f784665ab5e |\n| 8 | Organização de Equipes Ágeis | f593bd0c-29d9-4a17-9142-3ce9d0847ba8 | https://cursos.alura.com.br/certificate/f593bd0c-29d9-4a17-9142-3ce9d0847ba8 |\n| 9 | Scrum: agilidade em seu projeto | a4ef2164-8f95-4dd4-8ae9-2f7064363e0c | https://cursos.alura.com.br/certificate/a4ef2164-8f95-4dd4-8ae9-2f7064363e0c |\n| 10 | Quality Assurance: plano de testes e bugs | 30528766-c2e1-49e6-a1cf-28bc60d418dd | https://cursos.alura.com.br/certificate/30528766-c2e1-49e6-a1cf-28bc60d418dd |\n| 11 | Blockchain para Negócios | 71f544df-579b-4da6-9b2c-6f720314448b | https://cursos.alura.com.br/certificate/71f544df-579b-4da6-9b2c-6f720314448b |\n| 12 | Blockchain: aumente a confiança | 0443c7b1-d93c-4008-acf7-fcf7e175c430 | https://cursos.alura.com.br/certificate/0443c7b1-d93c-4008-acf7-fcf7e175c430 |\n| 13 | IA Generativa: Midjourney e ChatGPT | bc4ff00f-d3c1-457a-ab15-b3c78ab55770 | https://cursos.alura.com.br/certificate/bc4ff00f-d3c1-457a-ab15-b3c78ab55770 |\n| 14 | Value Stream Mapping (VSM): desenhe mapa | 17172eb2-7589-4243-899e-bd1ebdb2001c | https://cursos.alura.com.br/certificate/17172eb2-7589-4243-899e-bd1ebdb2001c |\n| 15 | Value Stream Mapping (VSM): conheça fluxo | ec0351b4-1a4d-4722-be3d-48addce732d7 | https://cursos.alura.com.br/certificate/ec0351b4-1a4d-4722-be3d-48addce732d7 |\n| 16 | RPA: aplicações gerais | 8498ab7f-6167-48d5-a416-756bc7e75590 | https://cursos.alura.com.br/certificate/8498ab7f-6167-48d5-a416-756bc7e75590 |\n| 17 | Bizagi: mapeamento com BPMN | b45495dd-a17b-4ebb-ae03-89cf9d3fbc39 | https://cursos.alura.com.br/certificate/b45495dd-a17b-4ebb-ae03-89cf9d3fbc39 |\n| 18 | UML: modelagem de diagramas | 5acd569d-4c75-47d1-b3ed-9dc51c3e6812 | https://cursos.alura.com.br/certificate/5acd569d-4c75-47d1-b3ed-9dc51c3e6812 |\n| 19 | UML: modelagem de soluções | 808d0a16-fbdb-45eb-9df0-e0d6ce18213f | https://cursos.alura.com.br/certificate/808d0a16-fbdb-45eb-9df0-e0d6ce18213f |\n| 20 | Linux Onboarding: CLI rápida e prática | 7c1e8280-1f67-49e2-bf86-aa24fe674921 | https://cursos.alura.com.br/certificate/7c1e8280-1f67-49e2-bf86-aa24fe674921 |\n| 21 | Aprenda Java com Orientação a Objetos | 60a265dd-c87a-4f00-91e5-c1e0680c1efc | https://cursos.alura.com.br/certificate/60a265dd-c87a-4f00-91e5-c1e0680c1efc |\n| 22 | Java: criando primeira aplicação | cb6ebd04-fc02-4c2b-bb30-87e61b3796d8 | https://cursos.alura.com.br/certificate/cb6ebd04-fc02-4c2b-bb30-87e61b3796d8 |\n| 23 | Java: Orientação a Objetos | 379a0ba4-997c-4cd6-90c3-c5eb8e48b3c6 | https://cursos.alura.com.br/certificate/379a0ba4-997c-4cd6-90c3-c5eb8e48b3c6 |\n| 24 | Java: listas e coleções de dados | 96742210-b3e7-4fc7-8b7b-7b3d3e6e82b8 | https://cursos.alura.com.br/certificate/96742210-b3e7-4fc7-8b7b-7b3d3e6e82b8 |\n| 25 | Java: API, arquivos e erros | e3e64464-cc6a-43cb-8d02-ee48dc7fb75c | https://cursos.alura.com.br/certificate/e3e64464-cc6a-43cb-8d02-ee48dc7fb75c |\n| 26 | C++: linguagem e STL | 2c3f2ae7-f7b4-4cc0-8862-7ff38a8b51bb | https://cursos.alura.com.br/certificate/2c3f2ae7-f7b4-4cc0-8862-7ff38a8b51bb |\n| 27 | SOLID com PHP: princípios OOP | 0a1776a5-2796-4c23-b0f1-78b2a9162ef2 | https://cursos.alura.com.br/certificate/0a1776a5-2796-4c23-b0f1-78b2a9162ef2 |\n| 28 | Avançando OOP com PHP | 09a0fb74-75f6-44b5-8544-60585d6de6e4 | https://cursos.alura.com.br/certificate/09a0fb74-75f6-44b5-8544-60585d6de6e4 |\n| 29 | Design Patterns em PHP | 160ab564-9b24-4e0c-9f71-146a3fd571e5 | https://cursos.alura.com.br/certificate/160ab564-9b24-4e0c-9f71-146a3fd571e5 |\n| 30 | Orientação a Objetos com PHP | d2d1ec5d-ed0b-454a-bf0a-1db9ade28831 | https://cursos.alura.com.br/certificate/d2d1ec5d-ed0b-454a-bf0a-1db9ade28831 |\n| 31 | JavaScript e HTML: desenvolva um jogo | 3912a7ca-edaa-4fee-9269-500620545693 | https://cursos.alura.com.br/certificate/3912a7ca-edaa-4fee-9269-500620545693 |\n| 32 | MongoDB: banco de dados NoSQL | 7f84cff8-cc22-44eb-af57-906e0866c2b3 | https://cursos.alura.com.br/certificate/7f84cff8-cc22-44eb-af57-906e0866c2b3 |\n\n\n---\n\n\n# Skills Taxonomy\n<!-- classification: PUBLIC -->\n\n> Source: `aboutme.md` — Exhaustive taxonomy. Skills linked to roles/institutions where declared.\n\n## Computer Science & Software Engineering\nSoftware Architecture, AI Context Generator, Software Engineering Practices, API Development, API REST, Node.js, PHP, Java, C#, C++, C, JavaScript, HTML, Python, Rust, Visual Basic, VBA, SQL, MySQL, MongoDB, Data Structures, Algorithms.\n\n## Blockchain & Web3\nBlockchain Technology, Bitcoin, Ethereum, Solidity, Criptografia.\n\n## Hardware & Embedded Systems\nDesenvolvedor de Hardware, Criador de Protótipos Eletrônicos, Desenvolvedor de Software Embarcado, Arduino, ESP8266 / ESP-8266.\n\n## DevOps & Infrastructure\nDocker, Linux, Operating Systems (Sistemas Operacionais), Integração e Entrega Contínuas (CI/CD).\n\n## Agile, Product & Management\nScrum, Agile Project Management, Operations Management, Business Analysis, Human Resources (HR), Account Management, Negociação, Liderança de Equipe, Gestão de Pessoas, Gestão de Contratos, Desenvolvimento de Gestão, Comunicação Interna, Consulting.\n\n## Finance, Economics & Trading\nEconomic Analysis, Financial Analysis, Structured Finance, Project Finance, Foreign Exchange (FX) Trading, Technical Analysis, Stock Market, Stock Exchange, Stock Management, Options Strategies, Candlestick Analysis (Candles), MetaTrader, Finance, Accountability.\n\n## Humanities, Sciences & Cognitive Abilities\nPolitical Science, Political Philosophy, Political Consulting, Political Communication, Philosophy of Science, Philosophy of Religion, Philosophy, Science, International Relations, Administrative Law, Teaching (Docência), Palestras, Memorization, Photographic Memory, Memory Management.\n\n## Corporate Tools & Marketing\nGoogle Ads, Google Analytics, Google Webmaster Tools, ERP Software, ERP Implementations, Business Intelligence (BI), Microsoft Office (Excel, Word, PowerPoint).\n\n## Soft Skills\nCompetências Interpessoais, Habilidades Analíticas.\n\n## Languages\n- Português (native)\n- English (Inglês para Negócios — business level)\n- Español (Spanish)\n- Hebrew (basic/liturgical)\n- Italian (basic/heritage)\n\n## Knowledge Domains (DefinedTerms → Wikidata)\n\n| Domain | Wikidata | Wikipedia |\n|:---|:---|:---|\n| Austrian School of economics | Q203411 | https://en.wikipedia.org/wiki/Austrian_School |\n| Chaos theory | Q254 | https://en.wikipedia.org/wiki/Chaos_theory |\n| Econophysics | Q932628 | https://en.wikipedia.org/wiki/Econophysics |\n| Complex adaptive system | Q581233 | https://en.wikipedia.org/wiki/Complex_adaptive_system |\n| Little's law | Q679586 | https://en.wikipedia.org/wiki/Little%27s_law |\n| Long short-term memory (LSTM) | Q6673524 | https://en.wikipedia.org/wiki/Long_short-term_memory |\n| Anomaly detection | Q3560506 | https://en.wikipedia.org/wiki/Anomaly_detection |\n| Market microstructure | Q6053360 | https://en.wikipedia.org/wiki/Market_microstructure |\n| Distributed computing | Q13136 | https://en.wikipedia.org/wiki/Distributed_computing |\n| Edge computing | Q226494 | https://en.wikipedia.org/wiki/Edge_computing |\n| Internet of things | Q251620 | https://en.wikipedia.org/wiki/Internet_of_things |\n| Zero trust security model | Q111664727 | https://en.wikipedia.org/wiki/Zero_trust_security_model |\n| Smart contract | Q1585649 | https://en.wikipedia.org/wiki/Smart_contract |\n| Monero | Q19893485 | https://en.wikipedia.org/wiki/Monero |\n| Ring signature | Q707714 | https://en.wikipedia.org/wiki/Ring_signature |\n| Secure multi-party computation | Q2891896 | https://en.wikipedia.org/wiki/Secure_multi-party_computation |\n\n\n---\n\n\n# Publications & Scientific Productions\n<!-- classification: PUBLIC -->\n\n> Source: `scientificproductions.md` — All 40 ORCID works mapped. 18 publications + 22 software programs.\n> Repositories with DOI are \"citable artifacts\" with full metadata.\n\n## GitHub Repositories & Zenodo DOIs (Citable Artifacts)\n\n### 1. cyberfinancial-resilience-lrblstm\n- schema_id: https://ulissesflores.com/#sw-lrblstm\n- schema_type: SoftwareSourceCode\n- repo: https://github.com/ulissesflores/cyberfinancial-resilience-lrblstm\n- codeRepository: https://github.com/ulissesflores/cyberfinancial-resilience-lrblstm\n- version: 0.1.1\n- doi: 10.5281/zenodo.18275035\n- doi_url: https://doi.org/10.5281/zenodo.18275035\n- license: Apache-2.0\n- license_url: https://spdx.org/licenses/Apache-2.0.html\n- programmingLanguage: Python\n- runtimePlatform: Google Colab / Python 3.10+\n- name:\n    pt-BR: Resiliência Ciberfinanceira via Lei de Little e LSTM Bayesiano (LR-BLSTM)\n    en: Cyber-Financial Resilience via Little's Law and Bayesian LSTM (LR-BLSTM)\n    es: Resiliencia Ciberfinanciera vía Ley de Little y LSTM Bayesiano (LR-BLSTM)\n- description:\n    en: >\n      Reproducible scientific pipeline for cyber-financial resilience analysis using\n      Little's Law proxies and Bayesian LSTM for anomaly detection in high-frequency trading.\n    pt-BR: >\n      Pipeline científico reprodutível para análise de resiliência ciberfinanceira usando\n      proxies da Lei de Little e LSTM Bayesiano para detecção de anomalias em trading de alta frequência.\n- keywords: [cyber-financial resilience, Little's Law, Bayesian LSTM, anomaly detection, Python, SimPy]\n\n### 2. llm-contextizer\n- schema_id: https://ulissesflores.com/#sw-llm-contextizer\n- schema_type: SoftwareSourceCode\n- repo: https://github.com/ulissesflores/llm-contextizer\n- releases:\n  - version: 0.1.1 | doi: 10.5281/zenodo.18343438 | doi_url: https://doi.org/10.5281/zenodo.18343438\n  - version: 0.1.2 | doi: 10.5281/zenodo.18343563 | doi_url: https://doi.org/10.5281/zenodo.18343563\n- name:\n    en: LLM Contextizer — Semantic Context Generator and Prompt Engineering for LLMs\n    pt-BR: Gerador de Contexto Semântico e Engenharia de Prompt para LLMs\n\n### 3. mit507-yape-architecture-sim\n- schema_id: https://ulissesflores.com/#sw-mit507-yape\n- schema_type: SoftwareSourceCode\n- repo: https://github.com/ulissesflores/mit507-yape-architecture-sim\n- releases:\n  - version: 1.0.0 | doi: 10.5281/zenodo.18641336 | doi_url: https://doi.org/10.5281/zenodo.18641336\n  - version: 2.0.0 | doi: 10.5281/zenodo.18645894 | doi_url: https://doi.org/10.5281/zenodo.18645894\n- name:\n    en: MIT-507 Yape Architecture Simulation — Discrete Event Simulation for Cell-Based Systems\n    pt-BR: Simulação de Arquitetura Yape MIT-507 — Simulação de Eventos Discretos para Sistemas Cell-Based\n\n## ORCID Works — Complete Inventory (40/40)\n\n> Notation: `[J]` = Journal article (ScholarlyArticle), `[R]` = Report, `[S]` = Software (SoftwareSourceCode).\n> Items with `url` have canonical URIs at ulissesflores.com. Items marked `[S]` without DOI are\n> registered in ORCID/Lattes but not yet deposited in Zenodo.\n>\n> **Provenance:** All 40 items sourced from ORCID 0000-0002-6034-7765 and cross-referenced\n> against Lattes CV 6905246706890561. Items with DOI have independent verification via Zenodo.\n> The `url` field points to the author's canonical publication page (ulissesflores.com) where\n> available. Source retrieval date: 2026-02-20.\n\n### 2025 (11 items)\n\n| # | T | Title | datePublished | inLanguage | url |\n|:--|:--|:---|:---|:---|:---|\n| 1 | J | A Lei de Little como Vetor de Resiliência e Qualidade | 2025 | pt-BR | https://ulissesflores.com/research/2025-little-law-resilience |\n| 2 | J | Análise Preditiva de Ativos Financeiros com Modelos LSTM | 2025 | pt-BR | https://ulissesflores.com/research/2025-lstm-asset-prediction |\n| 3 | R | Análise Termodinâmica e Engenharia de Sistemas Híbridos de Resfriamento | 2025 | pt-BR | https://ulissesflores.com/whitepapers/2025-hybrid-cooling-thermodynamics |\n| 4 | R | Arquiteturas Cloudless e Soberania de Dados em IoT | 2025 | pt-BR | https://ulissesflores.com/whitepapers/2025-iot-data-sovereignty |\n| 5 | S | Clube Santo: Plataforma Digital de Ensino Teológico e Comunidade | 2025 | pt-BR | — |\n| 6 | J | Detecção de Fraudes em Cartões com Redes Neurais | 2025 | pt-BR | https://ulissesflores.com/research/2025-fraud-detection-mlp |\n| 7 | S | Gerador de Contexto Semântico e Engenharia de Prompt para LLMs | 2025 | pt-BR | — |\n| 8 | S | Orquestração de Ambientes Inteligentes: Integração Tuya, Zigbee e Home Assistant | 2025 | pt-BR | — |\n| 9 | S | Pipeline de Extração e Estruturação de Conhecimento de Mídias Audiovisuais | 2025 | pt-BR | — |\n| 10 | S | Prototipagem de Estruturas Modulares em Alumínio e Painéis Digitais | 2025 | pt-BR | — |\n| 11 | S | Simulação de Inteligência de Enxame e Autômatos Celulares | 2025 | pt-BR | — |\n\n### 2024 (13 items)\n\n| # | T | Title | datePublished | inLanguage | url |\n|:--|:--|:---|:---|:---|:---|\n| 12 | J | Análise Historiográfica e Arqueológica Exaustiva: A Historicidade de Jesus | 2024 | pt-BR | https://ulissesflores.com/research/2024-historicity-jesus-archaeology |\n| 13 | S | Arquitetura de Microsserviços em Ambiente Serverless e Conteinerização | 2024 | pt-BR | — |\n| 14 | J | Bitcoin como Ativo de Reserva e a Teoria da Moeda na Escola Austríaca | 2024 | pt-BR | https://ulissesflores.com/research/2024-bitcoin-praxeology |\n| 15 | J | Canonização Escribal: Análise Histórico-Crítica da Formação do Cânon | 2024 | pt-BR | https://ulissesflores.com/research/2024-scribal-canonization-ezra |\n| 16 | S | Codex Hash Algo-Trading: Sistema Estocástico de Arbitragem | 2024 | pt-BR | — |\n| 17 | J | Fundamentos Transcendentes da Ordem Econômica | 2024 | pt-BR | https://ulissesflores.com/essays/2024-theology-economic-order |\n| 18 | R | Implementação de Ring Signatures e Endereços Furtivos | 2024 | pt-BR | https://ulissesflores.com/whitepapers/2024-ring-signatures-privacy |\n| 19 | S | Interface de Conversação Natural via Integração de APIs de LLM | 2024 | pt-BR | — |\n| 20 | S | Interface de Conversação Natural (Módulo II) | 2024 | pt-BR | — |\n| 21 | S | Plataforma de Análise de Dados Políticos e Monitoramento Legislativo | 2024 | pt-BR | — |\n| 22 | S | Protocolo de Crowdfunding Privativo | 2024 | pt-BR | — |\n| 23 | R | Transformação Ágil e Engenharia de Fluxo em Data Science | 2024 | pt-BR | https://ulissesflores.com/whitepapers/2024-agritech-agile-flow |\n| 24 | J | Tratado Exegético sobre a Representação da Moralidade e Antropologia | 2024 | pt-BR | https://ulissesflores.com/essays/2024-exegetical-treatise-anthropology |\n\n### 2023 (6 items)\n\n| # | T | Title | datePublished | inLanguage | url |\n|:--|:--|:---|:---|:---|:---|\n| 25 | J | A Coroa e a Cruz: Análise Teológica e Fenomenológica das Aparições Marianas | 2023 | pt-BR | https://ulissesflores.com/research/2023-marian-apparitions-critique |\n| 26 | S | BioBytes: Sistema de Preservação Digital de Memória | 2023 | pt-BR | — |\n| 27 | R | Desafios da Herança Digital: Preservação de Memória Pós-Mortem | 2023 | pt-BR | https://ulissesflores.com/whitepapers/2023-digital-legacy |\n| 28 | S | Gerador de Entropia e Gestão de Chaves Privadas | 2023 | pt-BR | — |\n| 29 | J | O Clube Santo: Arqueologia Espiritual, Teológica e Visual do Metodismo | 2023 | pt-BR | https://ulissesflores.com/research/2023-holy-club-methodism |\n| 30 | S | Time-Ledger System: Plataforma de Tokenização para Economia do Cuidado | 2023 | pt-BR | — |\n\n### 2022–1998 (10 items)\n\n| # | T | Year | Title | inLanguage | url |\n|:--|:--|:--|:---|:---|:---|\n| 31 | J | 2022 | A Teologia da Esperança em Tempos de Crise | pt-BR | https://ulissesflores.com/essays/2022-theology-of-hope |\n| 32 | S | 2022 | Sistema de Validação Estocástica e Análise Combinatória | pt-BR | — |\n| 33 | J | 2020 | Metodologias Ativas no Ensino de Lógica de Programação | pt-BR | https://ulissesflores.com/essays/2020-robotics-education |\n| 34 | S | 2020 | Robótica Educacional e Lógica de Programação para Jovens | pt-BR | — |\n| 35 | S | 2019 | Implementação de DLT Permissionada para Aplicações Bancárias | pt-BR | — |\n| 36 | S | 2018 | GoldenLeaf: Sistema Embarcado para Controle Ambiental | pt-BR | — |\n| 37 | J | 2017 | Teoria do Caos: Emergência e Auto-organização em Mercados | pt-BR | https://ulissesflores.com/essays/2017-chaos-theory-economics |\n| 38 | S | 2016 | Algoritmo de Cálculo Atuarial e Simulação de Aposentadoria | pt-BR | — |\n| 39 | S | 2015 | ERP-SIS: Sistema Integrado de Gestão Financeira | pt-BR | — |\n| 40 | S | 1998 | Sistemas de Processamento de Dados Financeiros em Ambientes Legados | pt-BR | — |\n\n**Total: 40/40 ORCID works mapped.** ✓\n\n\n---\n\n\n# Active Research Projects\n<!-- classification: PUBLIC -->\n\n## 1. Resiliência e Antifragilidade em Sistemas Complexos\n- schema_id: https://ulissesflores.com/#project-resilience-antifragility\n- schema_type: ResearchProject\n- status: In progress (since 2024)\n- funder_ref: https://ulissesflores.com/#codexhash\n- outputs_refs: [https://ulissesflores.com/#sw-lrblstm]\n- name:\n    pt-BR: Resiliência e Antifragilidade em Sistemas Complexos — Uma Abordagem Híbrida via IA e Economia Praxeológica\n    en: Resilience and Antifragility in Complex Systems — A Hybrid Approach via AI and Praxeological Economics\n    es: Resiliencia y Antifragilidad en Sistemas Complejos — Un Enfoque Híbrido mediante IA y Economía Praxeológica\n- description:\n    pt-BR: >\n      Pesquisa multidisciplinar na fronteira entre Ciência da Computação e Economia teórica,\n      estudando antifragilidade em sistemas distribuídos (Blockchain/DeFi) via agentes autônomos\n      baseados em LSTM, lógica fuzzy e otimização de fluxo pela Lei de Little, com restrições\n      praxeológicas da Escola Austríaca.\n    en: >\n      Multidisciplinary research at the boundary between Computer Science and theoretical Economics,\n      studying antifragility in distributed systems (Blockchain/DeFi) via LSTM-based autonomous agents,\n      fuzzy logic, and Little's Law flow optimization, with praxeological constraints from the Austrian School.\n\n## 2. Arqueologia Cognitiva e Crítica Textual\n- schema_id: https://ulissesflores.com/#project-cognitive-archaeology-textual-criticism\n- schema_type: ResearchProject\n- status: In progress (since 2023)\n- publisher_ref: https://ulissesflores.com/#instituto-clube-santo\n- name:\n    pt-BR: Arqueologia Cognitiva e Crítica Textual — Evidências Históricas na Formação do Cânon Bíblico\n    en: Cognitive Archaeology and Textual Criticism — Historical Evidence in Biblical Canon Formation\n    es: Arqueología Cognitiva y Crítica Textual — Evidencias Históricas en la Formación del Canon Bíblico\n- description:\n    pt-BR: >\n      Pesquisa histórico-crítica sobre origens documentais e materiais de textos bíblicos,\n      combinando crítica textual, arqueologia do Levante e análise de fontes extrabíblicas\n      sobre o Jesus histórico, com implicações para a formação ética ocidental.\n    en: >\n      Historical-critical research on documentary and material origins of biblical texts, combining textual\n      criticism, Levant archaeology, and analysis of extrabiblical sources on the historical Jesus, with\n      implications for Western ethical formation.\n\n## 3. Arquiteturas de Edge Computing e Criptografia em Hardware (IoT)\n- schema_id: https://ulissesflores.com/#project-edge-crypto-iot\n- schema_type: ResearchProject\n- status: In progress (since 2024)\n- funder_ref: https://ulissesflores.com/#codexhash\n- name:\n    pt-BR: Arquiteturas de Edge Computing e Criptografia em Hardware (IoT) para Confiança Zero\n    en: Edge Computing Architectures and Hardware Cryptography (IoT) for Zero Trust Environments\n    es: Arquitecturas de Edge Computing y Criptografía en Hardware (IoT) para Confianza Cero\n- description:\n    pt-BR: >\n      Desenvolvimento e validação de hardware embarcado cloudless (ESP32/Arduino) para soberania\n      de dados, operação zero-trust e criptografia de curvas elípticas em microcontroladores de\n      baixa potência; inclui sensoriamento industrial e automação de precisão (GoldenLeaf).\n    en: >\n      Development and validation of cloudless embedded hardware (ESP32/Arduino) for data sovereignty,\n      zero-trust operation, and elliptic-curve cryptography on low-power microcontrollers; includes\n      industrial sensing and precision automation (GoldenLeaf).\n\n\n---\n\n\n### Top 10 Publications — Multilingual Titles (EN/ES)\n\n> **Rationale:** The 10 most disruptive works are translated for international discoverability.\n> The generator should produce `name` as `@value/@language` arrays for these items.\n> Selection criteria: cross-disciplinary novelty, methodological contribution, or\n> strategic importance to the Codex Hash Research program.\n\n| # | Title (pt-BR) | Title (en) | Title (es) |\n|:--|:---|:---|:---|\n| 1 | Análise Preditiva de Ativos Financeiros com Modelos LSTM | Predictive Analysis of Financial Assets Using LSTM Models | Análisis Predictivo de Activos Financieros con Modelos LSTM |\n| 2 | Detecção de Fraudes em Cartões com Redes Neurais | Credit Card Fraud Detection Using Neural Networks | Detección de Fraudes en Tarjetas con Redes Neuronales |\n| 3 | Arquiteturas Cloudless e Soberania de Dados em IoT | Cloudless Architectures and Data Sovereignty in IoT | Arquitecturas Cloudless y Soberanía de Datos en IoT |\n| 4 | A Lei de Little como Vetor de Resiliência e Qualidade | Little's Law as a Vector for Resilience and Quality | La Ley de Little como Vector de Resiliencia y Calidad |\n| 5 | Bitcoin como Ativo de Reserva e a Teoria da Moeda na Escola Austríaca | Bitcoin as a Reserve Asset and Monetary Theory in the Austrian School | Bitcoin como Activo de Reserva y la Teoría Monetaria de la Escuela Austríaca |\n| 6 | Implementação de Ring Signatures e Endereços Furtivos | Implementation of Ring Signatures and Stealth Addresses | Implementación de Ring Signatures y Direcciones Furtivas |\n| 7 | Análise Historiográfica e Arqueológica Exaustiva: A Historicidade de Jesus | Comprehensive Historiographic and Archaeological Analysis: The Historicity of Jesus | Análisis Historiográfico y Arqueológico Exhaustivo: La Historicidad de Jesús |\n| 8 | Canonização Escribal: Análise Histórico-Crítica da Formação do Cânon | Scribal Canonization: A Historical-Critical Analysis of Canon Formation | Canonización Escribal: Análisis Histórico-Crítico de la Formación del Canon |\n| 9 | Análise Termodinâmica e Engenharia de Sistemas Híbridos de Resfriamento | Thermodynamic Analysis and Engineering of Hybrid Cooling Systems | Análisis Termodinámico e Ingeniería de Sistemas Híbridos de Enfriamiento |\n| 10 | Transformação Ágil e Engenharia de Fluxo em Data Science | Agile Transformation and Flow Engineering in Data Science | Transformación Ágil e Ingeniería de Flujo en Data Science |\n\n\n---\n\n\n# Organizations & Affiliations\n<!-- classification: PUBLIC (except where marked PRIVATE) -->\n\n## Codex Hash Ltda (Primary)\n- schema_id: https://ulissesflores.com/#codexhash\n- schema_type: Organization\n- legal_name: CODEX HASH LTDA\n- alternate_names: [CODEX HASH, Codex Hash Research Labs]\n- cnpj: 53.520.203/0001-75 <!-- classification: PUBLIC (government registry) -->\n- founding_date: 2024-01-16\n- url: https://codexhash.com\n- email: contato@codexhash.com <!-- classification: PUBLIC -->\n- address: Avenida Itacira, 2689, Planalto Paulista, São Paulo/SP, CEP 04061-003, BR <!-- classification: PUBLIC (gov registry) -->\n- capital: R$ 10.000,00\n- cnae_primary: 74.90-1-04\n- cnae_secondary: 63.19-4-00\n- description:\n    pt-BR: >\n      Laboratório de P&D (deep tech) focado em finanças quantitativas/Web3, engenharia de\n      hardware IoT (arquiteturas cloudless/edge) e IA aplicada para resiliência ciberfinanceira.\n    en: >\n      R&D deep-tech lab focused on quantitative finance/Web3, IoT hardware engineering\n      (cloudless/edge architectures), and applied AI for cyber-financial resilience.\n    es: >\n      Laboratorio de I+D (deep tech) enfocado en finanzas cuantitativas/Web3, ingeniería de\n      hardware IoT (arquitecturas cloudless/edge) e IA aplicada para resiliencia ciberfinanciera.\n    he: >\n      מעבדת מו\"פ (דיפ-טק) המתמקדת בפיננסים כמותיים/Web3, הנדסת חומרה IoT (ארכיטקטורות\n      ענן-ללא/קצה) ובינה מלאכותית לחוסן סייבר-פיננסי.\n    it: >\n      Laboratorio R&S (deep tech) focalizzato su finanza quantitativa/Web3, ingegneria hardware\n      IoT (architetture cloudless/edge) e IA applicata alla resilienza cyber-finanziaria.\n\n### Sub-Organization: Codex Hash Research\n- schema_id: https://ulissesflores.com/#codexhash-research\n- schema_type: Organization\n- parentOrganization_ref: https://ulissesflores.com/#codexhash\n- name:\n    pt-BR: Codex Hash Research\n    en: Codex Hash Research\n- url: https://codexhash.com/research\n- description:\n    pt-BR: Braço de pesquisa aplicada — publicações técnicas, software registrado com DOI e colaboração acadêmica.\n    en: Applied research arm — technical publications, DOI-registered software, and academic collaboration.\n    es: Brazo de investigación aplicada — publicaciones técnicas, software registrado con DOI y colaboración académica.\n    he: זרוע מחקר יישומי — פרסומים טכניים, תוכנה רשומה עם DOI ושיתוף פעולה אקדמי.\n    it: Braccio di ricerca applicata — pubblicazioni tecniche, software registrato con DOI e collaborazione accademica.\n\n### Sub-Organization: Codex Hash Labs\n- schema_id: https://ulissesflores.com/#codexhash-labs\n- schema_type: Organization\n- parentOrganization_ref: https://ulissesflores.com/#codexhash\n- name:\n    pt-BR: Codex Hash Labs\n    en: Codex Hash Labs\n- url: https://codexhash.com/labs\n- description:\n    pt-BR: Engenharia de sistemas e prototipagem — hardware IoT/edge, arquiteturas cloudless e segurança embarcada.\n    en: Systems engineering and prototyping — IoT/edge hardware, cloudless architectures, embedded security.\n    es: Ingeniería de sistemas y prototipado — hardware IoT/edge, arquitecturas cloudless y seguridad embebida.\n    he: הנדסת מערכות ואב-טיפוס — חומרת IoT/edge, ארכיטקטורות ללא ענן ואבטחה מוטמעת.\n    it: Ingegneria dei sistemi e prototipazione — hardware IoT/edge, architetture cloudless e sicurezza embedded.\n\n### Sub-Organization: Codex Hash Education\n- schema_id: https://ulissesflores.com/#codexhash-education\n- schema_type: Organization\n- parentOrganization_ref: https://ulissesflores.com/#codexhash\n- name:\n    pt-BR: Codex Hash Education\n    en: Codex Hash Education\n- url: https://codexhash.com/education\n- description:\n    pt-BR: Conteúdo, mentoria e educação técnica — cursos, workshops e engajamento comunitário.\n    en: Content, mentoring, and technical education — courses, workshops, and community engagement.\n    es: Contenido, mentoría y educación técnica — cursos, talleres y compromiso comunitario.\n    he: תוכן, חונכות וחינוך טכני — קורסים, סדנאות ומעורבות קהילתית.\n    it: Contenuti, mentoring e formazione tecnica — corsi, workshop e coinvolgimento della comunità.\n\n## Instituto Clube Santo\n- schema_id: https://ulissesflores.com/#instituto-clube-santo\n- schema_type: Organization\n- url: https://clubesanto.org\n- description:\n    pt-BR: Instituto de pesquisa em Teologia Histórica, Arqueologia Cognitiva e tradição Metodista Wesleyana.\n    en: Research institute for Historical Theology, Cognitive Archaeology, and the Wesleyan Methodist tradition.\n    es: Instituto de investigación en Teología Histórica, Arqueología Cognitiva y tradición Metodista Wesleyana.\n    he: מכון מחקר לתיאולוגיה היסטורית, ארכיאולוגיה קוגניטיבית ומסורת מתודיסטית וסליאנית.\n    it: Istituto di ricerca in Teologia Storica, Archeologia Cognitiva e tradizione Metodista Wesleyana.\n\n## Prefeitura Municipal de Itupeva\n- schema_id: https://ulissesflores.com/#prefeitura-itupeva\n- schema_type: GovernmentOrganization\n- name: Prefeitura Municipal de Itupeva\n- url: https://itupeva.sp.gov.br/\n- sameAs:\n    - https://www.wikidata.org/entity/Q734333\n    - https://en.wikipedia.org/wiki/Itupeva\n\n## Igreja do Evangelho Quadrangular — Vila Helena\n- schema_id: https://ulissesflores.com/#quadrangular-vila-helena\n- schema_type: Organization\n- url: https://www.youtube.com/@quadrangularvilahelena\n- relation: Pastoral ministry and sermon collection publisher\n\n\n---\n\n\n# Digital Assets & Web3 Identifiers\n\n## Public Identifiers\n<!-- classification: PUBLIC -->\n\n| Identifier | Value | Verifiable URL | Notes |\n|:---|:---|:---|:---|\n| ORCID | 0000-0002-6034-7765 | https://orcid.org/0000-0002-6034-7765 | Strong anchor |\n| Lattes | 6905246706890561 | http://lattes.cnpq.br/6905246706890561 | Strong anchor |\n| DID | did:web:ulissesflores.com | https://ulissesflores.com/.well-known/did.json | W3C DID |\n| RNS.ID (Palau) | LUA3604A | https://rns.id/ | National digital ID (Palau) |\n| ENS | ulissesflores.eth | https://app.ens.domains/ulissesflores.eth | Ethereum Name Service |\n| Ethereum | 0x2b146dc6Ea5C2385c7EfFF10a09a96955E96F3C3 | https://etherscan.io/address/0x2b146dc6Ea5C2385c7EfFF10a09a96955E96F3C3 | Primary wallet (L1) |\n| Ethereum (Base L2) | 0x2b146dc6Ea5C2385c7EfFF10a09a96955E96F3C3 | https://basescan.org/address/0x2b146dc6Ea5C2385c7EfFF10a09a96955E96F3C3 | Base chain attestations |\n| BTC | bc1qqddqpxufw7d2utfav2qa0mwe9ztkwx6qqe5t4g | https://mempool.space/address/bc1qqddqpxufw7d2utfav2qa0mwe9ztkwx6qqe5t4g | Bitcoin address |\n| IPFS CID | bafybeiefgqaigidav2fnccz57s4tr2fb6eapv3qmwxpnvl73s3adi5thjy | https://bafybeiefgqaigidav2fnccz57s4tr2fb6eapv3qmwxpnvl73s3adi5thjy.ipfs.dweb.link/ | Site pinned (IPFS gateway) |\n| Keybase | ul1ss3sfl0r3s | https://keybase.io/ul1ss3sfl0r3s | PGP + social proofs |\n| Gitcoin Passport | 39 | https://passport.gitcoin.co/ | Sybil resistance score |\n| Humanity Score | 39.7 | https://base.easscan.org/address/0x2b146dc6Ea5C2385c7EfFF10a09a96955E96F3C3 | Base EAS attestation |\n| PGP Fingerprint | af30 44aa df8b d6cc 16a9 5750 d4e0 4e74 2ac8 f678 | https://keybase.io/ul1ss3sfl0r3s/pgp_keys.asc | Public key via Keybase |\n\n## sameAs (Canonical Profile Links)\n<!-- classification: PUBLIC -->\n\n- https://www.linkedin.com/in/ulisses-flores-75961921\n- https://github.com/ulissesflores\n- https://orcid.org/0000-0002-6034-7765\n- http://lattes.cnpq.br/6905246706890561\n- https://www.tiktok.com/@ulissesflores\n- https://www.instagram.com/ulissesflores\n- https://www.facebook.com/ulissesflores\n- https://ulissesflores.com/\n- https://keybase.io/ul1ss3sfl0r3s\n- https://gist.github.com/ulissesflores/\n- https://ulissesflores.eth.limo\n- https://gravatar.com/ulissesflores\n- https://ulisses.omg.lol\n- https://groups.google.com/g/androidbrasil/c/d7onDwJ5ekA?pli=1\n- gitperson (user-declared identity anchor)\n\n## Domain Inventory (Hub & Spoke — 15 domains)\n<!-- classification: PUBLIC -->\n\n| # | Domain | URL | Category | Purpose |\n|:--|:---|:---|:---|:---|\n| 1 | ulissesflores.com | https://ulissesflores.com/ | **HUB (canonical)** | Primary sovereign site |\n| 2 | ulissesflor.es | https://ulissesflor.es/ | Brand protection | Vanity redirect |\n| 3 | ulisses.digital | https://ulisses.digital/ | Brand protection | Redirect |\n| 4 | ulissesflores.org | https://ulissesflores.org/ | Brand protection | Redirect |\n| 5 | carlosulisses.com.br | https://carlosulisses.com.br/ | Brand protection | BR legacy |\n| 6 | carlosulissesflores.com.br | https://carlosulissesflores.com.br/ | Brand protection | BR legacy |\n| 7 | ulissesflores.com.br | https://ulissesflores.com.br/ | Brand protection | BR legacy |\n| 8 | cuf.dev.br | https://cuf.dev.br/ | Brand protection | Dev initials |\n| 9 | ulisses.solutions | https://ulisses.solutions/ | Deep link | Service page |\n| 10 | ulissesflores.dev | https://ulissesflores.dev/ | Deep link | Developer profile |\n| 11 | ulisses.ia.br | https://ulisses.ia.br/ | Deep link | AI focus |\n| 12 | 11-97272-7532.me | https://11-97272-7532.me/ | Deep link | Phone-to-web |\n| 13 | ul1ss.es | https://ul1ss.es/ | Infrastructure | Vanity / shortener |\n| 14 | anamnese.cc | https://anamnese.cc/ | Project | Isolated project |\n| 15 | horarionibus.com.br | https://horarionibus.com.br/ | Project | Isolated project |\n\n### Web3 Presence\n\n| Identifier | URL |\n|:---|:---|\n| ulisses.omg.lol | https://ulisses.omg.lol |\n| ulissesflores.eth.limo | https://ulissesflores.eth.limo |\n| ulissesflores.eth | ENS domain (censorship-resistant) |\n\n## Contact Points\n<!-- classification: PRIVATE -->\n\n- email_personal: c.ulisses@gmail.com\n- email_public: hello@ulissesflores.com\n- email_business: contato@codexhash.com\n- phone: +55-11-97272-7532\n\n## Addresses\n<!-- classification: PRIVATE -->\n\n- home: Bairro Santa Fé, Itupeva-SP, 13295-570, BR\n- business: Avenida Itacira, 2689, Planalto Paulista, São Paulo-SP, 04061-003, BR\n\n\n---\n\n\n# Mundo Político — Blog Posts (19 articles, itemized)\n<!-- classification: PUBLIC -->\n<!-- schema_type: Blog → BlogPosting -->\n\n- blog_url: https://mundopolitico.com.br/\n- blog_schema_id: https://mundopolitico.com.br/#blog\n- author_page: https://mundopolitico.com.br/artigos/autor/ulisses-flores\n- inLanguage: pt-BR\n- total_articles: 19\n\n> **URL Strategy:** `@id` anchored at ulissesflores.com (semantic identity); `url` points to\n> mundopolitico.com.br (actual resource location). The generator must produce both.\n\n| # | datePublished | headline_pt-BR | url |\n|:--|:---|:---|:---|\n| 1 | 2026-01-15 | Campanha do governo Lula para reconstruir confiança no Pix: detalhes e impactos | https://mundopolitico.com.br/campaigno-do-governo-lula-para-reconstruir-confianca-no-pix-detalhes-e-impactos |\n| 2 | 2026-01-15 | Conflito nas redes sociais: moderação de conteúdo vs. liberdade de expressão | https://mundopolitico.com.br/conflito-nas-redes-sociais-moderacao-de-conteudo-versus-liberdade-de-expressao |\n| 3 | 2026-01-15 | Desaprovação de Lula cresce no Nordeste: mudanças na lealdade política | https://mundopolitico.com.br/desaprovacao-de-lula-cresce-no-nordeste-mudancas-na-lealdade-politica |\n| 4 | 2026-01-15 | Pacote fiscal de Lula: expectativas e desafios para a economia brasileira | https://mundopolitico.com.br/pacote-fiscal-de-lula-expectativas-e-desafios-para-a-economia-brasileira-em-2023 |\n| 5 | 2026-01-15 | Preservação de valores tradicionais na era da diversidade | https://mundopolitico.com.br/preservacao-de-valores-tradicionais-na-era-da-diversidade |\n| 6 | 2026-01-16 | Análise das consequências dos perdões de Trump e paralelos com o Brasil | https://mundopolitico.com.br/analise-das-consequencias-dos-perdoes-de-trump-e-paralelos-com-o-brasil |\n| 7 | 2026-01-16 | Discrepâncias no Brasil: análise crítica da economia e política atuais | https://mundopolitico.com.br/discrepancias-no-brasil-analise-critica-da-economia-e-politica-atuais |\n| 8 | 2026-01-16 | Insatisfação popular cresce: como um vídeo viral no Instagram expõe gastos governamentais | https://mundopolitico.com.br/insatisfacao-popular-cresce-como-um-video-viral-no-instagram-explora-gastos-governamentais |\n| 9 | 2026-01-16 | Reforma eleitoral no Brasil: necessidade de maior transparência e comparação com os EUA | https://mundopolitico.com.br/reforma-eleitoral-no-brasil-a-necessidade-de-maior-transparencia-e-comparacao-com-os-eua |\n| 10 | 2026-01-17 | Fiscalização do Pix: estratégia do governo Lula contra a sonegação | https://mundopolitico.com.br/fiscalizacao-do-pix-estrategia-do-governo-lula-contra-a-sonegacao |\n| 11 | 2025-02-20 | Impacto da geopolítica nos mercados: tensões EUA–China e o futuro econômico | https://mundopolitico.com.br/impacto-da-geopolitica-nos-mercados-analise-das-tensoes-eua-china-e-futuro-economico |\n| 12 | 2025-02-09 | Combate à inflação no governo Lula: estratégias e impactos nos gastos públicos | https://mundopolitico.com.br/combate-a-inflacao-no-governo-lula-estrategias-e-impactos-nos-gastos-publicos |\n| 13 | 2025-02-18 | Governo Lula confronta alta dos preços de alimentos: estratégias e impactos internos | https://mundopolitico.com.br/governo-lula-confronta-alta-dos-precos-de-alimentos-estrategias-e-impactos-internos |\n| 14 | 2025-02-18 | Lewandowski desafia EUA sobre deportações algemadas: impacto nas relações Brasil-EUA | https://mundopolitico.com.br/lewandowski-desafia-eua-sobre-deportacoes-algemadas-impacto-nas-relacoes-brasil-eua |\n| 15 | 2025-02-17 | Polêmica em Porto Alegre: performance de \"Jesus\" no Carnaval reacende debate | https://mundopolitico.com.br/polemica-em-porto-alegre-performance-de-jesus-em-carnaval-desperta-debate-sobre-liberdade-e-respeito-religioso |\n| 16 | 2025-02-12 | Relação Brasil–EUA: impacto de Trump e Eduardo Bolsonaro na política global | https://mundopolitico.com.br/relacao-brasil-eua-impacto-de-trump-e-eduardo-bolsonaro-na-politica-global |\n| 17 | 2025-02-20 | Tancredo Neves e o impacto no 40º aniversário de uma transição democrática | https://mundopolitico.com.br/tancredo-neves-e-o-impacto-no-40o-aniversario-de-uma-transicao-democratica-no-brasil |\n| 18 | 2025-02-18 | Vigilância do governo Lula e liberdade de expressão: impacto no Brasil moderno | https://mundopolitico.com.br/vigilancia-do-governo-lula-e-liberdade-de-expressao-impacto-no-brasil-moderno |\n| 19 | 2025-02-18 | Análise atual: impacto dos eventos históricos na política contemporânea | https://mundopolitico.com.br/analise-atual-impacto-dos-eventos-historicos-na-politica-contemporanea |\n\n> **NOTE:** All 19 posts now have `datePublished` filled (ISO-8601).\n> If the generator encounters any future UNDATED items, it MUST omit `datePublished` (never serialize as empty string).\n\n\n---\n\n\n# Sermons & Theological Talks (56 items, itemized)\n<!-- classification: PUBLIC -->\n<!-- schema_type: Collection → CreativeWorkSeries → Sermon -->\n\n- collection_schema_id: https://ulissesflores.com/#sermons\n- publisher_ref: https://ulissesflores.com/#quadrangular-vila-helena\n- channel_url: https://www.youtube.com/@quadrangularvilahelena\n- inLanguage: pt-BR (all sermons; no translations applicable)\n- period: Jul 2022 – Feb 2023\n- total: 56\n\n> **URL Strategy:** `@id` anchored at ulissesflores.com; `url` should point to individual\n> YouTube video URLs when available.\n\n## Collection: Jejum da Vitória 2023 (21 devotionals)\n- series_schema_id: https://ulissesflores.com/#sermons#jejumdavitoria\n\n| # | name_pt-BR | datePublished | youtube_url |\n|:--|:---|:---|:---|\n| 1 | Dia 1 — O Despertar da Fé | 2023-01-02 | https://www.youtube.com/watch?v=NLAIyBqC4HU |\n| 2 | Dia 2 — Vencendo as Batalhas da Mente | 2023-01-03 | https://www.youtube.com/watch?v=9YY1_EbBk_o |\n| 3 | Dia 3 — A Resiliência do Cristão | 2023-01-04 | https://www.youtube.com/watch?v=UD8W6bm_nys |\n| 4 | Dia 4 — Quebrando as Muralhas Pela Oração | 2023-01-05 | https://www.youtube.com/watch?v=x4C_bJBXmAE |\n| 5 | Dia 5 — O Poder da Unidade | 2023-01-06 | https://www.youtube.com/watch?v=TLNNov8cBPs |\n| 6 | Dia 6 — Restituição Divina | 2023-01-07 | https://www.youtube.com/watch?v=mtkDxX2XiEU |\n| 7 | Dia 7 — A Plenitude do Espírito | 2023-01-08 | https://www.youtube.com/watch?v=jv0PsLg8cho |\n| 8 | Dia 8 — Tempo de Renovo | 2023-01-09 | https://www.youtube.com/watch?v=XODx3VUZp1Y |\n| 9 | Dia 9 — Frutos de Uma Vida com Deus | 2023-01-10 | https://www.youtube.com/watch?v=3jLWYAOdorE |\n| 10 | Dia 10 — Autoridade Espiritual | 2023-01-11 | https://www.youtube.com/watch?v=CC4pY7oXU3w |\n| 11 | Dia 11 — A Força da Palavra | 2023-01-12 | https://www.youtube.com/watch?v=wiK8Ckj24XQ |\n| 12 | Dia 12 — Alinhamento Profético | 2023-01-13 | https://www.youtube.com/watch?v=i4pcggtnSko |\n| 13 | Dia 13 — Ousadia para Romper Limites | 2023-01-14 | https://www.youtube.com/watch?v=PLXuFzpR6XY |\n| 14 | Dia 14 — A Recompensa da Fidelidade | 2023-01-15 | https://www.youtube.com/watch?v=ui-xDNtmpYw |\n| 15 | Dia 15 — Proteção e Escudo | 2023-01-16 | https://www.youtube.com/watch?v=iZSbu2u0ORo |\n| 16 | Dia 16 — Avançando em Meio às Oposições | 2023-01-17 | https://www.youtube.com/watch?v=7jXjSGKuaEs |\n| 17 | Dia 17 — Celebração Antecipada | 2023-01-18 | https://www.youtube.com/watch?v=B_q2gnCx6H0 |\n| 18 | Dia 18 — Destravando Promessas | 2023-01-19 | https://www.youtube.com/watch?v=e2e_npI5Tqg |\n| 19 | Dia 19 — O Fogo Que Não se Apaga | 2023-01-20 | https://www.youtube.com/watch?v=7F2l5DD3NuM |\n| 20 | Dia 20 — Preparando o Altar | 2023-01-21 | https://www.youtube.com/watch?v=Yt7HU3NwJAw |\n| 21 | Dia 21 — O Selo da Vitória | 2023-01-22 | https://www.youtube.com/watch?v=qLH3tloXWXE |\n\n\n\n## Collection: Cultos Online (27 services)\n- series_schema_id: https://ulissesflores.com/#sermons#cultosonline\n\n| # | name_pt-BR | datePublished | youtube_url |\n|:--|:---|:---|:---|\n| 1 | Presença e Avivamento | 2022-10-30 | https://www.youtube.com/watch?v=Y7A6q62VpJM |\n| 2 | O Chamado Inabalável — 07/08/22 | 2022-08-07 | https://www.youtube.com/watch?v=6fRWwVcf-k0 |\n| 3 | Firmes na Promessa — 14/08/22 | 2022-08-14 | https://www.youtube.com/watch?v=BdLM6uzBFgI |\n| 4 | A Importância da Intimidade — 18/08/2022 | 2022-08-18 | https://www.youtube.com/watch?v=Wc2WCYiM3Gc |\n| 5 | Construindo Uma Vida com Propósito — 21/08/2022 | 2022-08-21 | https://www.youtube.com/watch?v=TyHh01KaXGw |\n| 6 | Restaurando o Altar — 25/08/2022 | 2022-08-25 | https://www.youtube.com/watch?v=u1v4oAamxUg |\n| 7 | O Agir Invisível de Deus — 28/08/2022 | 2022-08-28 | https://www.youtube.com/watch?v=cOZnirlxr8U |\n| 8 | Atravessando Tempestades com Fé — 04/09/2022 | 2022-09-04 | https://www.youtube.com/watch?v=4Hg6UHYXENY |\n| 9 | O Perdão que Liberta — 11/09/2022 | 2022-09-11 | https://www.youtube.com/watch?v=pTAJOi1--tY |\n| 10 | Vencendo o Medo Pela Graça — 15/09/2022 | 2022-09-15 | https://www.youtube.com/watch?v=ariz4Xm4lks |\n| 11 | Chamados Para Fazer a Diferença — 18/09/2022 | 2022-09-18 | https://www.youtube.com/watch?v=4lxzEWZ4AN8 |\n| 12 | Batismo nas águas: Nova Vida em Cristo — 25/09/2022 | 2022-09-25 | https://www.youtube.com/watch?v=D6pF7ZMa9UM |\n| 13 | Semeando em Boa Terra — 02/10/2022 | 2022-10-02 | https://www.youtube.com/watch?v=Xl95QoBBQdo |\n| 14 | A Cruz e o Seu Significado Hoje — 23/10/2022 | 2022-10-23 | https://www.youtube.com/watch?v=kQIEbtM57Go |\n| 15 | Caminhando em Sobrenaturalidade — 06/11/2022 | 2022-11-06 | https://www.youtube.com/watch?v=YQrIOabiMoQ |\n| 16 | Identidade: Quem Somos em Cristo? — 13/11/2022 | 2022-11-13 | https://www.youtube.com/watch?v=CJPxc-6fy04 |\n| 17 | Cultivando um Coração Grato — 20/11 | 2022-11-20 | https://www.youtube.com/watch?v=kaKPhbBvo04 |\n| 18 | Renovando as Forças no Altar — 27/11/2022 | 2022-11-27 | https://www.youtube.com/watch?v=vhFhr1Qxyw4 |\n| 19 | A Esperança Que Não Decepciona — 04/12/2022 | 2022-12-04 | https://www.youtube.com/watch?v=s5oh63j0Itc |\n| 20 | Preparando o Coração Para o Novo Ano — 11/12/2022 | 2022-12-11 | https://www.youtube.com/watch?v=gkeiRaXiCMI |\n| 21 | Fortalecendo as Bases da Fé — 15/01/2023 | 2023-01-15 | https://www.youtube.com/watch?v=aSSpJn9ggaw |\n| 22 | O Agir do Espírito em Nossas Vidas — 22/01/2023 | 2023-01-22 | https://www.youtube.com/watch?v=O9HCFQI4rK4 |\n| 23 | Aprendendo a Ouvir a Voz de Deus — 29/01/2023 | 2023-01-29 | https://www.youtube.com/watch?v=WYOYxtc5OUM |\n| 24 | Comunhão e Crescimento Espiritual — 05/02/2023 | 2023-02-05 | https://www.youtube.com/watch?v=t9wESfLpYrc |\n| 25 | Quebrando Cadeias Invisíveis — 12/02/2023 | 2023-02-12 | https://www.youtube.com/watch?v=iLDmtOS8DT4 |\n| 26 | Viver em Santidade no Século XXI — 19/02/2023 | 2023-02-19 | https://www.youtube.com/watch?v=Dtli1GcgBKA |\n| 27 | Festival de dança: Expressão de Adoração e Arte Profética | 2022-08-20 | https://www.youtube.com/watch?v=wN4FlJtEHuY |\n\n## Collection: Cultos (3 services)\n- series_schema_id: https://ulissesflores.com/#sermons#cultos\n\n| # | name_pt-BR | datePublished | youtube_url |\n|:--|:---|:---|:---|\n| 1 | Restaurando o Primeiro Amor — 24/07/22 | 2022-07-24 | https://www.youtube.com/watch?v=rm5_xlw-JH4 |\n| 2 | O Poder Transformador da Graça — 31/07/22 | 2022-07-31 | https://www.youtube.com/watch?v=SJ_8fliMJoE |\n| 3 | Culto regional de casais: Edificando a Família Sobre a Rocha — 03/09/2022 | 2022-09-03 | https://www.youtube.com/watch?v=ny5D6FRIUgo |\n\n## Collection: Outros (5 specials)\n- series_schema_id: https://ulissesflores.com/#sermons#outros\n\n| # | name_pt-BR | datePublished | youtube_url |\n|:--|:---|:---|:---|\n| 1 | Janeiro Profético: Consagrando o Novo Ano (Dia 1) — 01/01/2023 | 2023-01-01 | https://www.youtube.com/watch?v=YEzeDRZTkDk |\n| 2 | Perseverança e Resposta (Dia 8) | 2023-01-08 | https://www.youtube.com/watch?v=eUuMWxIqUFY |\n| 3 | O Selo Profético Para os 12 Meses de Vitória (Dia 12) | 2023-01-12 | https://www.youtube.com/watch?v=eJRJDpo0V7s |\n| 4 | O Grande Rompimento: Celebração dos Testemunhos (Dia 40) | 2022-09-21 | https://www.youtube.com/watch?v=Y8vCcqbQgns |\n| 5 | Cantata de Natal: O Verbo que se Fez Carne e Habitou Entre Nós — 18/12/2022 | 2022-12-18 | https://www.youtube.com/watch?v=Ci0Bc1TQkN4 |\n\n---\n\n\n# Provenance & Derivation Specification\n\n## Source-of-Truth Mapping\n\n| UPKF Section | JSON-LD Target | Schema Type |\n|:---|:---|:---|\n| Core Identity > Canonical Identity | `#person` node | Person |\n| Core Identity > Disambiguation | `disambiguatingDescription` | Person |\n| Core Identity > Heritage | EXCLUDED from public.jsonld | — |\n| Professional Taxonomy > Occupations | `hasOccupation` | Occupation |\n| Professional Taxonomy > Experience | `worksFor`, `affiliation` | Organization |\n| Academic Background > Degrees | `hasCredential`, `alumniOf` | EducationalOccupationalCredential |\n| Skills Taxonomy > Knowledge Domains | `knowsAbout` (DefinedTerm → Wikidata) | DefinedTerm |\n| Publications > ORCID Works | Individual nodes | ScholarlyArticle / Report / SoftwareSourceCode |\n| Digital Assets > Identifiers | `identifier` | PropertyValue |\n| Digital Assets > sameAs | `sameAs` array on Person | — |\n| Domain Inventory | `ItemList` of `WebSite` nodes | WebSite |\n| Mundo Político > Posts | `BlogPosting` under `Blog` | BlogPosting |\n| Sermons > Items | `Sermon` under `Collection` | Sermon |\n\n## Deterministic Derivation Rules\n\n1. **Dates:** ISO-8601 (`YYYY-MM-DD`). Fields marked `PENDING` → omit from JSON-LD (do not fabricate).\n2. **Names:** Preserve `canonical_legal_name` + `preferred_name` + `alternate_names`.\n3. **Do not infer.** If not explicit in this file, omit from JSON-LD.\n4. **Third-party graphs** (Wikidata, etc.) are weak signals unless referenced by strong anchors.\n5. **Multilingual:** Use `@value` + `@language` arrays. Only serialize languages actually present — never duplicate strings across languages.\n6. **Classification:** Respect `PUBLIC/PRIVATE/RESTRICTED` markers. Generator must support `--mode=public|private|full`.\n7. **Trust signal triangulation:** CNPJ (government) + Lattes (academic) + DOI (scientific) = high-confidence entity.\n8. **URL strategy:** `@id` = semantic anchor at ulissesflores.com; `url` = actual resource location (may differ).\n\n## Derivation Architecture\n\n```\n┌─────────────────────┐\n│  THIS FILE (.md)    │  ← Human edits HERE (canonical source)\n│  UPKF v3.3          │\n└────────┬────────────┘\n         │ parse\n         ▼\n┌─────────────────────┐\n│  Generator Script   │  ← JSON-LD serialization rules live HERE\n│  (upkf-to-jsonld)   │     W3C TR/json-ld conformance\n│                     │     @context, @graph, @id, @type\n│                     │     @value/@language arrays\n└────────┬────────────┘\n         │ --mode=public|private|full\n         ▼\n┌─────────────────────────────────────────┐\n│  public.jsonld   │  private.jsonld  │  full.jsonld  │\n│  (deploy to site) │  (internal only) │  (never deploy)│\n└──────────────────┴──────────────────┴───────────────┘\n```\n\n## Validation Checklist (for JSON-LD derivation)\n\n- [ ] Google Rich Results Test: https://search.google.com/test/rich-results\n- [ ] Schema Markup Validator: https://validator.schema.org/\n- [ ] JSON-LD Playground: https://json-ld.org/playground/\n- [ ] Verify all `sameAs` URLs resolve (HTTP 200)\n- [ ] Verify all DOI links resolve (doi.org → Zenodo)\n- [ ] Confirm `credentialStatus` for MSc is \"InProgress\"\n- [ ] Confirm `disambiguatingDescription` mentions Oscar Ulisses Flores Ruiz in all 5 languages\n- [ ] Confirm PENDING fields are OMITTED (not serialized as empty strings)\n- [ ] Confirm Heritage section is EXCLUDED from public.jsonld\n- [ ] Confirm Contact Points are EXCLUDED from public.jsonld\n- [ ] Run JSON Schema validation on generated output\n- [ ] Verify all `schema_id` references resolve within the graph (no orphans)\n- [ ] Verify all `parentOrganization_ref` and `institution_ref` resolve to defined nodes\n- [ ] Verify all `institution_url` and `institution_sameAs` resolve (HTTP 200)\n- [ ] Verify all Web3 explorer URLs resolve to correct addresses\n- [ ] Verify notSameAs properties are serialized as additionalProperty on Person node\n- [ ] Verify UNDATED items have NO datePublished in output\n- [ ] Verify PENDING items have NO field serialized in public mode\n- [ ] Verify default-deny PII fields (email/phone/address) are stripped in public mode\n- [ ] Generate and attach JWS detached signature for public.jsonld\n- [ ] Verify all `verify_url` links resolve (HTTP 200) for certificates\n- [ ] Verify top 10 publications have EN/ES title translations in output\n- [ ] Verify Jejum da Vitória dates (2023-01-02 through 2023-01-22) match 21-day series\n\n## Changelog\n\n### v3.3 (2026-02-21)\n- **NEW:** All 32 Alura certifications now have individual `verify_url` (full dereferenceable URLs)\n- **NEW:** edX certification now has `verify_url`\n- **NEW:** SOTA mapping note for `verify_url` → Schema.org `url` on `EducationalOccupationalCredential` + W3C VC alignment\n- **NEW:** Top 10 disruptive publications translated to EN and ES (cross-disciplinary selection)\n- **NEW:** Jejum da Vitória 21 devotionals: ISO dates assigned (2023-01-02 through 2023-01-22)\n- **NEW:** Validation checklist expanded to 23 items\n- **FIX:** PENDING/UNDATED contract contradiction resolved — per-mode rules now unambiguous (public: omit both; private: serialize PENDING, omit UNDATED; full: serialize all)\n- **FIX:** \"No file hashes\" policy clarified — transient digests for JWS signing are permitted; no standalone manifests stored\n- **FIX:** Derivation diagram updated from v3.1 → v3.3\n- **FIX:** Footer updated from v3.1 → v3.3\n\n### v3.2 (2026-02-21)\n- **NEW:** Default-deny PII policy — email/phone/address/genealogy are PRIVATE by default\n- **NEW:** Build mode contracts with explicit field exclusion rules per mode\n- **NEW:** PENDING vs UNDATED semantics formalized in governance section\n- **NEW:** Integrity policy — JWS detached signature spec (RFC 7515) for published JSON-LD\n- **NEW:** All Web3 identifiers now have verifiable explorer URLs (etherscan, mempool.space, ENS app, IPFS dweb gateway, basescan, Keybase PGP, Gitcoin Passport)\n- **NEW:** Ethereum Base L2 identifier added (same address, basescan explorer)\n- **NEW:** Institution URLs added: AGTU, Padre Anchieta, UNIP, CEFOR, California College San Diego\n- **NEW:** Institution Wikidata sameAs added: FIAP (Q10269779), UNIP (Q2301653), Edinburgh (Q160302)\n- **NEW:** Sub-organizations (Research/Labs/Education) now have 5-language descriptions (pt-BR/en/es/he/it)\n- **NEW:** Instituto Clube Santo: 5-language description + URL\n- **NEW:** Structured negative identity claims (notSameAs) with 4 explicit negative assertions\n- **NEW:** Provenance attribution block for publications (source + retrieval date)\n- **NEW:** Sermon tables now include datePublished column (29 ISO dates, 21 year-level, 6 UNDATED)\n- **NEW:** Validation checklist expanded to 21 items (from 13 in v3.1)\n- **FIX:** Blog posts without dates changed from PENDING to UNDATED (honest: no source has these dates)\n- **FIX:** Duplicate \"Collection: Outros\" editorial error removed\n- **FIX:** Generator MUST omit UNDATED/PENDING fields (never serialize as empty string)\n- **FIX:** \"Culto online — 20/11\" resolved to 2022-11-20\n\n### v3.1 (2026-02-20)\n- **NEW:** Data classification policy (PUBLIC/PRIVATE/RESTRICTED) with build modes\n- **NEW:** All 19 Mundo Político posts itemized with URLs and dates (9 dates PENDING)\n- **NEW:** All 56 sermons itemized by collection with youtube_url placeholder (PENDING)\n- **NEW:** Sub-organizations (Research/Labs/Education) promoted to first-class nodes with schema_id + parentOrganization_ref\n- **NEW:** Publications enriched with datePublished, inLanguage, type indicator per item\n- **NEW:** Derivation architecture diagram (MD → Generator → JSON-LD)\n- **NEW:** schema_id added to all roles, occupations, and credentials\n- **NEW:** institution_ref cross-references added to all academic entries\n- **NEW:** Multilingual fields normalized as objects `{ pt-BR: ..., en: ..., es: ... }` instead of flat `_pt-BR` suffixes\n- **NEW:** Extended validation checklist (13 items vs. 7 in v3.0)\n- **FIX:** Silk Road Vault description now includes EN and ES translations\n- **FIX:** Research projects now include output_refs linking to software artifacts\n- **FIX:** Heritage section explicitly marked PRIVATE\n- **FIX:** Contact points and addresses explicitly marked PRIVATE\n\n### v3.0 (2026-02-20)\n- Initial sovereign UPKF merge from 5 source files\n- 40/40 ORCID works mapped\n- 15/15 domains inventoried\n- 32 Alura certifications with UUIDs\n- 5-language disambiguation firewall\n- Odysseus metaphor and Palau Pledge motto\n- Genealogical audit (3 clusters)\n\n---\n\n*End of Sovereign UPKF v3.3 — Generated 2026-02-21.*\n*This file is the canonical source of truth. All JSON-LD must be derived from it.*\n*JSON-LD serialization rules belong in the generator, not in this file.*\n",
      "encodingFormat": "text/markdown",
      "inLanguage": [
        "pt-BR",
        "en",
        "es",
        "he",
        "it"
      ],
      "url": "https://ulissesflores.com/public.jsonld",
      "sourceOrganization": {
        "@id": "https://ulissesflores.com/#person"
      },
      "isBasedOn": {
        "@type": "CreativeWork",
        "name": "ulisses-flores-sovereign-upkf_v3.3.md",
        "text": "/Users/ulissesflores/Documents/Projetos/ulisses-hub/data/upkf/ulisses-flores-sovereign-upkf_v3.3.md"
      },
      "hasPart": [
        {
          "@id": "https://ulissesflores.com/#upkf-section-1"
        },
        {
          "@id": "https://ulissesflores.com/#upkf-section-2"
        },
        {
          "@id": "https://ulissesflores.com/#upkf-section-3"
        },
        {
          "@id": "https://ulissesflores.com/#upkf-section-4"
        },
        {
          "@id": "https://ulissesflores.com/#upkf-section-5"
        },
        {
          "@id": "https://ulissesflores.com/#upkf-section-6"
        },
        {
          "@id": "https://ulissesflores.com/#upkf-section-7"
        },
        {
          "@id": "https://ulissesflores.com/#upkf-section-8"
        },
        {
          "@id": "https://ulissesflores.com/#upkf-section-9"
        },
        {
          "@id": "https://ulissesflores.com/#upkf-section-10"
        },
        {
          "@id": "https://ulissesflores.com/#upkf-section-11"
        },
        {
          "@id": "https://ulissesflores.com/#upkf-section-12"
        },
        {
          "@id": "https://ulissesflores.com/#upkf-section-13"
        },
        {
          "@id": "https://ulissesflores.com/#upkf-section-14"
        },
        {
          "@id": "https://ulissesflores.com/#upkf-section-15"
        },
        {
          "@id": "https://ulissesflores.com/#upkf-section-16"
        },
        {
          "@id": "https://ulissesflores.com/#upkf-section-17"
        },
        {
          "@id": "https://ulissesflores.com/#upkf-section-18"
        },
        {
          "@id": "https://ulissesflores.com/#upkf-section-19"
        },
        {
          "@id": "https://ulissesflores.com/#upkf-section-20"
        },
        {
          "@id": "https://ulissesflores.com/#upkf-section-21"
        },
        {
          "@id": "https://ulissesflores.com/#upkf-section-22"
        },
        {
          "@id": "https://ulissesflores.com/#upkf-section-23"
        },
        {
          "@id": "https://ulissesflores.com/#upkf-section-24"
        },
        {
          "@id": "https://ulissesflores.com/#upkf-section-25"
        },
        {
          "@id": "https://ulissesflores.com/#upkf-section-26"
        },
        {
          "@id": "https://ulissesflores.com/#upkf-section-27"
        },
        {
          "@id": "https://ulissesflores.com/#upkf-section-28"
        },
        {
          "@id": "https://ulissesflores.com/#upkf-section-29"
        },
        {
          "@id": "https://ulissesflores.com/#upkf-section-30"
        },
        {
          "@id": "https://ulissesflores.com/#upkf-section-31"
        },
        {
          "@id": "https://ulissesflores.com/#upkf-section-32"
        },
        {
          "@id": "https://ulissesflores.com/#upkf-section-33"
        },
        {
          "@id": "https://ulissesflores.com/#upkf-section-34"
        },
        {
          "@id": "https://ulissesflores.com/#upkf-section-35"
        },
        {
          "@id": "https://ulissesflores.com/#upkf-section-36"
        },
        {
          "@id": "https://ulissesflores.com/#upkf-section-37"
        },
        {
          "@id": "https://ulissesflores.com/#upkf-section-38"
        },
        {
          "@id": "https://ulissesflores.com/#upkf-section-39"
        },
        {
          "@id": "https://ulissesflores.com/#upkf-section-40"
        },
        {
          "@id": "https://ulissesflores.com/#upkf-section-41"
        },
        {
          "@id": "https://ulissesflores.com/#upkf-section-42"
        },
        {
          "@id": "https://ulissesflores.com/#upkf-section-43"
        },
        {
          "@id": "https://ulissesflores.com/#upkf-section-44"
        },
        {
          "@id": "https://ulissesflores.com/#upkf-section-45"
        },
        {
          "@id": "https://ulissesflores.com/#upkf-section-46"
        },
        {
          "@id": "https://ulissesflores.com/#upkf-section-47"
        },
        {
          "@id": "https://ulissesflores.com/#upkf-section-48"
        },
        {
          "@id": "https://ulissesflores.com/#upkf-section-49"
        },
        {
          "@id": "https://ulissesflores.com/#upkf-section-50"
        },
        {
          "@id": "https://ulissesflores.com/#upkf-section-51"
        },
        {
          "@id": "https://ulissesflores.com/#upkf-section-52"
        },
        {
          "@id": "https://ulissesflores.com/#upkf-section-53"
        },
        {
          "@id": "https://ulissesflores.com/#upkf-section-54"
        },
        {
          "@id": "https://ulissesflores.com/#upkf-section-55"
        },
        {
          "@id": "https://ulissesflores.com/#upkf-section-56"
        },
        {
          "@id": "https://ulissesflores.com/#upkf-section-57"
        },
        {
          "@id": "https://ulissesflores.com/#upkf-section-58"
        },
        {
          "@id": "https://ulissesflores.com/#upkf-section-59"
        },
        {
          "@id": "https://ulissesflores.com/#upkf-section-60"
        },
        {
          "@id": "https://ulissesflores.com/#upkf-section-61"
        },
        {
          "@id": "https://ulissesflores.com/#upkf-section-62"
        },
        {
          "@id": "https://ulissesflores.com/#upkf-section-63"
        },
        {
          "@id": "https://ulissesflores.com/#upkf-section-64"
        },
        {
          "@id": "https://ulissesflores.com/#upkf-section-65"
        },
        {
          "@id": "https://ulissesflores.com/#upkf-section-66"
        },
        {
          "@id": "https://ulissesflores.com/#upkf-section-67"
        },
        {
          "@id": "https://ulissesflores.com/#upkf-section-68"
        },
        {
          "@id": "https://ulissesflores.com/#upkf-section-69"
        },
        {
          "@id": "https://ulissesflores.com/#upkf-section-70"
        },
        {
          "@id": "https://ulissesflores.com/#upkf-section-71"
        },
        {
          "@id": "https://ulissesflores.com/#upkf-section-72"
        },
        {
          "@id": "https://ulissesflores.com/#upkf-section-73"
        },
        {
          "@id": "https://ulissesflores.com/#upkf-section-74"
        },
        {
          "@id": "https://ulissesflores.com/#upkf-section-75"
        },
        {
          "@id": "https://ulissesflores.com/#upkf-section-76"
        },
        {
          "@id": "https://ulissesflores.com/#upkf-section-77"
        },
        {
          "@id": "https://ulissesflores.com/#upkf-section-78"
        },
        {
          "@id": "https://ulissesflores.com/#upkf-section-79"
        },
        {
          "@id": "https://ulissesflores.com/#upkf-section-80"
        },
        {
          "@id": "https://ulissesflores.com/#upkf-section-81"
        },
        {
          "@id": "https://ulissesflores.com/#upkf-section-82"
        },
        {
          "@id": "https://ulissesflores.com/#upkf-section-83"
        },
        {
          "@id": "https://ulissesflores.com/#upkf-section-84"
        },
        {
          "@id": "https://ulissesflores.com/#upkf-section-85"
        },
        {
          "@id": "https://ulissesflores.com/#upkf-section-86"
        },
        {
          "@id": "https://ulissesflores.com/#upkf-section-87"
        },
        {
          "@id": "https://ulissesflores.com/#upkf-section-88"
        },
        {
          "@id": "https://ulissesflores.com/#upkf-section-89"
        },
        {
          "@id": "https://ulissesflores.com/#upkf-section-90"
        },
        {
          "@id": "https://ulissesflores.com/#upkf-section-91"
        },
        {
          "@id": "https://ulissesflores.com/#upkf-section-92"
        },
        {
          "@id": "https://ulissesflores.com/#upkf-section-93"
        },
        {
          "@id": "https://ulissesflores.com/#upkf-section-94"
        },
        {
          "@id": "https://ulissesflores.com/#upkf-section-95"
        },
        {
          "@id": "https://ulissesflores.com/#upkf-section-96"
        },
        {
          "@id": "https://ulissesflores.com/#upkf-section-97"
        },
        {
          "@id": "https://ulissesflores.com/#upkf-section-98"
        },
        {
          "@id": "https://ulissesflores.com/#upkf-section-99"
        },
        {
          "@id": "https://ulissesflores.com/#upkf-section-100"
        },
        {
          "@id": "https://ulissesflores.com/#upkf-section-101"
        },
        {
          "@id": "https://ulissesflores.com/#upkf-section-102"
        }
      ],
      "includesObject": [
        {
          "@id": "https://ulissesflores.com/#pub-2025-little-law-resilience"
        },
        {
          "@id": "https://ulissesflores.com/#pub-2025-lstm-asset-prediction"
        },
        {
          "@id": "https://ulissesflores.com/#pub-2025-hybrid-cooling-thermodynamics"
        },
        {
          "@id": "https://ulissesflores.com/#pub-2025-iot-data-sovereignty"
        },
        {
          "@id": "https://ulissesflores.com/#pub-2025-fraud-detection-mlp"
        },
        {
          "@id": "https://ulissesflores.com/#pub-2024-historicity-jesus-archaeology"
        },
        {
          "@id": "https://ulissesflores.com/#pub-2024-bitcoin-praxeology"
        },
        {
          "@id": "https://ulissesflores.com/#pub-2024-scribal-canonization-ezra"
        },
        {
          "@id": "https://ulissesflores.com/#pub-2024-theology-economic-order"
        },
        {
          "@id": "https://ulissesflores.com/#pub-2024-ring-signatures-privacy"
        },
        {
          "@id": "https://ulissesflores.com/#pub-2024-agritech-agile-flow"
        },
        {
          "@id": "https://ulissesflores.com/#pub-2024-exegetical-treatise-anthropology"
        },
        {
          "@id": "https://ulissesflores.com/#pub-2023-marian-apparitions-critique"
        },
        {
          "@id": "https://ulissesflores.com/#pub-2023-digital-legacy"
        },
        {
          "@id": "https://ulissesflores.com/#pub-2023-holy-club-methodism"
        },
        {
          "@id": "https://ulissesflores.com/#pub-2022-theology-of-hope"
        },
        {
          "@id": "https://ulissesflores.com/#pub-2020-robotics-education"
        },
        {
          "@id": "https://ulissesflores.com/#pub-2017-chaos-theory-economics"
        }
      ]
    },
    {
      "@id": "https://ulissesflores.com/#website",
      "@type": "WebSite",
      "name": "Ulisses Flores — Sovereign UPKF (Universal Personal Knowledge Framework)",
      "url": "https://ulissesflores.com",
      "inLanguage": [
        "pt-BR",
        "en",
        "es",
        "he",
        "it"
      ]
    },
    {
      "@id": "https://ulissesflores.com/#person",
      "@type": "Person",
      "name": "Carlos Ulisses Flores Ribeiro",
      "alternateName": [
        "Carlos Ulisses Flores",
        "Ulisses Flores",
        "C. U. Flores",
        "Flores, C. U.",
        "FLORES, C. U."
      ],
      "givenName": "Ulisses",
      "birthDate": "1983",
      "url": "https://ulissesflores.com",
      "sameAs": [
        "https://www.linkedin.com/in/ulisses-flores-75961921",
        "https://github.com/ulissesflores",
        "https://orcid.org/0000-0002-6034-7765",
        "http://lattes.cnpq.br/6905246706890561",
        "https://www.tiktok.com/@ulissesflores",
        "https://www.instagram.com/ulissesflores",
        "https://www.facebook.com/ulissesflores",
        "https://ulissesflores.com/",
        "https://keybase.io/ul1ss3sfl0r3s",
        "https://gist.github.com/ulissesflores/",
        "https://ulissesflores.eth.limo",
        "https://gravatar.com/ulissesflores",
        "https://ulisses.omg.lol",
        "https://groups.google.com/g/androidbrasil/c/d7onDwJ5ekA?pli=1"
      ],
      "disambiguatingDescription": "Polymath researcher, economic scientist, and CTO of Codex Hash. Distinct entity from the Salvadoran beach soccer player Oscar Ulisses Flores Ruiz, from the homonymous architect from Poços de Caldas, and from the homonymous nurse. Operates in Artificial Intelligence, Economics, and Theology, not in sports or healthcare. Canonical identity bound to ulissesflores.com, ORCID 0000-0002-6034-7765, and Lattes 6905246706890561.",
      "description": "Cientista econômico, analista de sistemas e pesquisador polímata, atuando na interseção entre sistemas complexos, resiliência ciberfinanceira, economia austríaca, sistemas distribuídos e teologia histórica. Co-fundador e CTO da Codex Hash Ltda.",
      "identifier": [
        {
          "@type": "PropertyValue",
          "propertyID": "ORCID",
          "value": "0000-0002-6034-7765"
        },
        {
          "@type": "PropertyValue",
          "propertyID": "Lattes",
          "value": "6905246706890561"
        }
      ],
      "additionalProperty": [
        {
          "@type": "PropertyValue",
          "propertyID": "notSameAs",
          "value": "Oscar Ulisses Flores Ruiz (Salvadoran beach soccer player, FIFA-registered)"
        },
        {
          "@type": "PropertyValue",
          "propertyID": "notSameAs",
          "value": "the architect \"Ulisses Flores\" from Poços de Caldas, MG (CAU/MG registry)"
        },
        {
          "@type": "PropertyValue",
          "propertyID": "notSameAs",
          "value": "the nurse \"Ulisses Flores\" in Brazilian healthcare registries (COREN)"
        },
        {
          "@type": "PropertyValue",
          "propertyID": "notSameAs",
          "value": "any entity lacking at least one strong anchor listed above"
        }
      ],
      "worksFor": {
        "@id": "https://ulissesflores.com/#codexhash"
      }
    },
    {
      "@id": "https://ulissesflores.com/#codexhash",
      "@type": "Organization",
      "name": "Codex Hash",
      "legalName": "CODEX HASH LTDA",
      "identifier": {
        "@type": "PropertyValue",
        "propertyID": "CNPJ",
        "value": "53.520.203/0001-75"
      },
      "foundingDate": "2024-01-16",
      "url": "https://codexhash.com",
      "email": "contato@codexhash.com",
      "address": {
        "@type": "PostalAddress",
        "streetAddress": "Avenida Itacira, 2689, Planalto Paulista, São Paulo/SP, CEP 04061-003, BR",
        "addressCountry": "BR"
      },
      "description": "Laboratório de P&D (deep tech) focado em finanças quantitativas/Web3, engenharia de hardware IoT (arquiteturas cloudless/edge) e IA aplicada para resiliência ciberfinanceira."
    },
    {
      "@id": "https://ulissesflores.com/#codexhash-research",
      "@type": "Organization",
      "name": "Codex Hash Research",
      "url": "https://codexhash.com/research",
      "parentOrganization": {
        "@id": "https://ulissesflores.com/#codexhash"
      }
    },
    {
