/* AUTO-GENERATED FILE. DO NOT EDIT MANUALLY.
 * Source: /Users/ulissesflores/Documents/Projetos/ulisses-hub/public/upkf-source.md
 * Generated at: 2026-02-21
 */

export const knowledgeData = {
  "generatedAt": "2026-02-21",
  "authorityProfile": {
    "personRef": "https://ulissesflores.com/#person",
    "jobTitle": [
      "CTO",
      "Consultor Estratégico em IA",
      "Palestrante Profissional",
      "Arquiteto de Sistemas"
    ],
    "knowsAbout": [
      "Artificial Intelligence Governance",
      "Autonomous Agents Architecture",
      "Austrian Economics",
      "Web3 Sovereign Identity",
      "Complex Systems Resiliency",
      "Austrian School of economics",
      "Chaos theory",
      "Econophysics",
      "Complex adaptive system",
      "Little's law",
      "Long short-term memory (LSTM)",
      "Anomaly detection",
      "Market microstructure",
      "Distributed computing",
      "Edge computing",
      "Internet of things",
      "Zero trust security model",
      "Smart contract",
      "Monero",
      "Ring signature",
      "Secure multi-party computation"
    ],
    "hasCredential": [
      {
        "id": "https://ulissesflores.com/#credential-palau-digital-residency",
        "name": "RNS.ID Digital Residency (Palau)",
        "identifier": "LUA3604A",
        "credentialCategory": "Digital Residency",
        "url": "https://rns.id/"
      },
      {
        "id": "https://ulissesflores.com/#credential-gitcoin-passport",
        "name": "Gitcoin Passport",
        "identifier": "39",
        "credentialCategory": "Web3 Identity Credential",
        "url": "https://passport.gitcoin.co/"
      }
    ],
    "geographicallyServes": [
      "Itupeva",
      "Jundiaí",
      "Campinas",
      "São Paulo",
      "Brazil",
      "Italy",
      "United States",
      "El Salvador",
      "Israel"
    ],
    "sovereignIdentity": {
      "palauDigitalResidency": {
        "label": "RNS.ID (Palau)",
        "value": "LUA3604A",
        "url": "https://rns.id/",
        "notes": "National digital ID (Palau)"
      },
      "gitcoinPassport": {
        "label": "Gitcoin Passport",
        "value": "39",
        "url": "https://passport.gitcoin.co/",
        "notes": "Sybil resistance score"
      },
      "keybaseUrl": "https://keybase.io/ul1ss3sfl0r3s",
      "gravatarUrl": "https://gravatar.com/ulissesflores"
    },
    "domainInventory": [
      {
        "position": 1,
        "domain": "ulissesflores.com",
        "url": "https://ulissesflores.com/",
        "category": "**HUB (canonical)**",
        "purpose": "Primary sovereign site"
      },
      {
        "position": 2,
        "domain": "ulissesflor.es",
        "url": "https://ulissesflor.es/",
        "category": "Brand protection",
        "purpose": "Vanity redirect"
      },
      {
        "position": 3,
        "domain": "ulisses.digital",
        "url": "https://ulisses.digital/",
        "category": "Brand protection",
        "purpose": "Redirect"
      },
      {
        "position": 4,
        "domain": "ulissesflores.org",
        "url": "https://ulissesflores.org/",
        "category": "Brand protection",
        "purpose": "Redirect"
      },
      {
        "position": 5,
        "domain": "carlosulisses.com.br",
        "url": "https://carlosulisses.com.br/",
        "category": "Brand protection",
        "purpose": "BR legacy"
      },
      {
        "position": 6,
        "domain": "carlosulissesflores.com.br",
        "url": "https://carlosulissesflores.com.br/",
        "category": "Brand protection",
        "purpose": "BR legacy"
      },
      {
        "position": 7,
        "domain": "ulissesflores.com.br",
        "url": "https://ulissesflores.com.br/",
        "category": "Brand protection",
        "purpose": "BR legacy"
      },
      {
        "position": 8,
        "domain": "cuf.dev.br",
        "url": "https://cuf.dev.br/",
        "category": "Brand protection",
        "purpose": "Dev initials"
      },
      {
        "position": 9,
        "domain": "ulisses.solutions",
        "url": "https://ulisses.solutions/",
        "category": "Deep link",
        "purpose": "Service page"
      },
      {
        "position": 10,
        "domain": "ulissesflores.dev",
        "url": "https://ulissesflores.dev/",
        "category": "Deep link",
        "purpose": "Developer profile"
      },
      {
        "position": 11,
        "domain": "ulisses.ia.br",
        "url": "https://ulisses.ia.br/",
        "category": "Deep link",
        "purpose": "AI focus"
      },
      {
        "position": 12,
        "domain": "11-97272-7532.me",
        "url": "https://11-97272-7532.me/",
        "category": "Deep link",
        "purpose": "Phone-to-web"
      },
      {
        "position": 13,
        "domain": "ul1ss.es",
        "url": "https://ul1ss.es/",
        "category": "Infrastructure",
        "purpose": "Vanity / shortener"
      },
      {
        "position": 14,
        "domain": "anamnese.cc",
        "url": "https://anamnese.cc/",
        "category": "Project",
        "purpose": "Isolated project"
      },
      {
        "position": 15,
        "domain": "horarionibus.com.br",
        "url": "https://horarionibus.com.br/",
        "category": "Project",
        "purpose": "Isolated project"
      }
    ]
  },
  "certifications": [
    {
      "slug": "alura-1-entrega-continua-confiabilidade-e-qualidade",
      "canonicalPath": "/certifications/alura-1-entrega-continua-confiabilidade-e-qualidade",
      "provider": "Alura",
      "name": "Entrega Contínua: confiabilidade e qualidade",
      "certId": "d9007353-b9db-4db2-99de-303fca241275",
      "verifyUrl": "https://cursos.alura.com.br/certificate/d9007353-b9db-4db2-99de-303fca241275",
      "issuerRef": "https://ulissesflores.com/#alura",
      "position": 1,
      "summary": "Professional training credential in \"Entrega Contínua: confiabilidade e qualidade\" with direct verification URL.",
      "publishedAt": "2026-02-21"
    },
    {
      "slug": "alura-2-formacao-engenharia-de-software",
      "canonicalPath": "/certifications/alura-2-formacao-engenharia-de-software",
      "provider": "Alura",
      "name": "Formação Engenharia de software",
      "certId": "5305169e-3597-4c80-b8b5-703da11b943b",
      "verifyUrl": "https://cursos.alura.com.br/certificate/5305169e-3597-4c80-b8b5-703da11b943b",
      "issuerRef": "https://ulissesflores.com/#alura",
      "position": 2,
      "summary": "Professional training credential in \"Formação Engenharia de software\" with direct verification URL.",
      "publishedAt": "2026-02-21"
    },
    {
      "slug": "alura-3-integracao-continua-qualidade-e-menos-risco",
      "canonicalPath": "/certifications/alura-3-integracao-continua-qualidade-e-menos-risco",
      "provider": "Alura",
      "name": "Integração Contínua: qualidade e menos risco",
      "certId": "1fa80160-ea76-45e2-98e6-854119a5b1ba",
      "verifyUrl": "https://cursos.alura.com.br/certificate/1fa80160-ea76-45e2-98e6-854119a5b1ba",
      "issuerRef": "https://ulissesflores.com/#alura",
      "position": 3,
      "summary": "Professional training credential in \"Integração Contínua: qualidade e menos risco\" with direct verification URL.",
      "publishedAt": "2026-02-21"
    },
    {
      "slug": "alura-4-microsservicos-na-pratica",
      "canonicalPath": "/certifications/alura-4-microsservicos-na-pratica",
      "provider": "Alura",
      "name": "Microsserviços na prática",
      "certId": "f0ee7e80-1355-4646-aba3-81419f961b50",
      "verifyUrl": "https://cursos.alura.com.br/certificate/f0ee7e80-1355-4646-aba3-81419f961b50",
      "issuerRef": "https://ulissesflores.com/#alura",
      "position": 4,
      "summary": "Professional training credential in \"Microsserviços na prática\" with direct verification URL.",
      "publishedAt": "2026-02-21"
    },
    {
      "slug": "alura-5-microsservicos-explorando-conceitos",
      "canonicalPath": "/certifications/alura-5-microsservicos-explorando-conceitos",
      "provider": "Alura",
      "name": "Microsserviços: explorando conceitos",
      "certId": "141db7ae-325b-4bbc-9e29-1b7b086545f9",
      "verifyUrl": "https://cursos.alura.com.br/certificate/141db7ae-325b-4bbc-9e29-1b7b086545f9",
      "issuerRef": "https://ulissesflores.com/#alura",
      "position": 5,
      "summary": "Professional training credential in \"Microsserviços: explorando conceitos\" with direct verification URL.",
      "publishedAt": "2026-02-21"
    },
    {
      "slug": "alura-6-microsservicos-padroes-de-projeto",
      "canonicalPath": "/certifications/alura-6-microsservicos-padroes-de-projeto",
      "provider": "Alura",
      "name": "Microsserviços: padrões de projeto",
      "certId": "eb7851a8-5ad1-4187-a2a1-a852bc7c55ee",
      "verifyUrl": "https://cursos.alura.com.br/certificate/eb7851a8-5ad1-4187-a2a1-a852bc7c55ee",
      "issuerRef": "https://ulissesflores.com/#alura",
      "position": 6,
      "summary": "Professional training credential in \"Microsserviços: padrões de projeto\" with direct verification URL.",
      "publishedAt": "2026-02-21"
    },
    {
      "slug": "alura-7-extreme-programming-metodologia-agil",
      "canonicalPath": "/certifications/alura-7-extreme-programming-metodologia-agil",
      "provider": "Alura",
      "name": "Extreme Programming: metodologia ágil",
      "certId": "5f6f8b86-d216-4ab6-b63e-7f784665ab5e",
      "verifyUrl": "https://cursos.alura.com.br/certificate/5f6f8b86-d216-4ab6-b63e-7f784665ab5e",
      "issuerRef": "https://ulissesflores.com/#alura",
      "position": 7,
      "summary": "Professional training credential in \"Extreme Programming: metodologia ágil\" with direct verification URL.",
      "publishedAt": "2026-02-21"
    },
    {
      "slug": "alura-8-organizacao-de-equipes-ageis",
      "canonicalPath": "/certifications/alura-8-organizacao-de-equipes-ageis",
      "provider": "Alura",
      "name": "Organização de Equipes Ágeis",
      "certId": "f593bd0c-29d9-4a17-9142-3ce9d0847ba8",
      "verifyUrl": "https://cursos.alura.com.br/certificate/f593bd0c-29d9-4a17-9142-3ce9d0847ba8",
      "issuerRef": "https://ulissesflores.com/#alura",
      "position": 8,
      "summary": "Professional training credential in \"Organização de Equipes Ágeis\" with direct verification URL.",
      "publishedAt": "2026-02-21"
    },
    {
      "slug": "alura-9-scrum-agilidade-em-seu-projeto",
      "canonicalPath": "/certifications/alura-9-scrum-agilidade-em-seu-projeto",
      "provider": "Alura",
      "name": "Scrum: agilidade em seu projeto",
      "certId": "a4ef2164-8f95-4dd4-8ae9-2f7064363e0c",
      "verifyUrl": "https://cursos.alura.com.br/certificate/a4ef2164-8f95-4dd4-8ae9-2f7064363e0c",
      "issuerRef": "https://ulissesflores.com/#alura",
      "position": 9,
      "summary": "Professional training credential in \"Scrum: agilidade em seu projeto\" with direct verification URL.",
      "publishedAt": "2026-02-21"
    },
    {
      "slug": "alura-10-quality-assurance-plano-de-testes-e-bugs",
      "canonicalPath": "/certifications/alura-10-quality-assurance-plano-de-testes-e-bugs",
      "provider": "Alura",
      "name": "Quality Assurance: plano de testes e bugs",
      "certId": "30528766-c2e1-49e6-a1cf-28bc60d418dd",
      "verifyUrl": "https://cursos.alura.com.br/certificate/30528766-c2e1-49e6-a1cf-28bc60d418dd",
      "issuerRef": "https://ulissesflores.com/#alura",
      "position": 10,
      "summary": "Professional training credential in \"Quality Assurance: plano de testes e bugs\" with direct verification URL.",
      "publishedAt": "2026-02-21"
    },
    {
      "slug": "alura-11-blockchain-para-negocios",
      "canonicalPath": "/certifications/alura-11-blockchain-para-negocios",
      "provider": "Alura",
      "name": "Blockchain para Negócios",
      "certId": "71f544df-579b-4da6-9b2c-6f720314448b",
      "verifyUrl": "https://cursos.alura.com.br/certificate/71f544df-579b-4da6-9b2c-6f720314448b",
      "issuerRef": "https://ulissesflores.com/#alura",
      "position": 11,
      "summary": "Professional training credential in \"Blockchain para Negócios\" with direct verification URL.",
      "publishedAt": "2026-02-21"
    },
    {
      "slug": "alura-12-blockchain-aumente-a-confianca",
      "canonicalPath": "/certifications/alura-12-blockchain-aumente-a-confianca",
      "provider": "Alura",
      "name": "Blockchain: aumente a confiança",
      "certId": "0443c7b1-d93c-4008-acf7-fcf7e175c430",
      "verifyUrl": "https://cursos.alura.com.br/certificate/0443c7b1-d93c-4008-acf7-fcf7e175c430",
      "issuerRef": "https://ulissesflores.com/#alura",
      "position": 12,
      "summary": "Professional training credential in \"Blockchain: aumente a confiança\" with direct verification URL.",
      "publishedAt": "2026-02-21"
    },
    {
      "slug": "alura-13-ia-generativa-midjourney-e-chatgpt",
      "canonicalPath": "/certifications/alura-13-ia-generativa-midjourney-e-chatgpt",
      "provider": "Alura",
      "name": "IA Generativa: Midjourney e ChatGPT",
      "certId": "bc4ff00f-d3c1-457a-ab15-b3c78ab55770",
      "verifyUrl": "https://cursos.alura.com.br/certificate/bc4ff00f-d3c1-457a-ab15-b3c78ab55770",
      "issuerRef": "https://ulissesflores.com/#alura",
      "position": 13,
      "summary": "Professional training credential in \"IA Generativa: Midjourney e ChatGPT\" with direct verification URL.",
      "publishedAt": "2026-02-21"
    },
    {
      "slug": "alura-14-value-stream-mapping-vsm-desenhe-mapa",
      "canonicalPath": "/certifications/alura-14-value-stream-mapping-vsm-desenhe-mapa",
      "provider": "Alura",
      "name": "Value Stream Mapping (VSM): desenhe mapa",
      "certId": "17172eb2-7589-4243-899e-bd1ebdb2001c",
      "verifyUrl": "https://cursos.alura.com.br/certificate/17172eb2-7589-4243-899e-bd1ebdb2001c",
      "issuerRef": "https://ulissesflores.com/#alura",
      "position": 14,
      "summary": "Professional training credential in \"Value Stream Mapping (VSM): desenhe mapa\" with direct verification URL.",
      "publishedAt": "2026-02-21"
    },
    {
      "slug": "alura-15-value-stream-mapping-vsm-conheca-fluxo",
      "canonicalPath": "/certifications/alura-15-value-stream-mapping-vsm-conheca-fluxo",
      "provider": "Alura",
      "name": "Value Stream Mapping (VSM): conheça fluxo",
      "certId": "ec0351b4-1a4d-4722-be3d-48addce732d7",
      "verifyUrl": "https://cursos.alura.com.br/certificate/ec0351b4-1a4d-4722-be3d-48addce732d7",
      "issuerRef": "https://ulissesflores.com/#alura",
      "position": 15,
      "summary": "Professional training credential in \"Value Stream Mapping (VSM): conheça fluxo\" with direct verification URL.",
      "publishedAt": "2026-02-21"
    },
    {
      "slug": "alura-16-rpa-aplicacoes-gerais",
      "canonicalPath": "/certifications/alura-16-rpa-aplicacoes-gerais",
      "provider": "Alura",
      "name": "RPA: aplicações gerais",
      "certId": "8498ab7f-6167-48d5-a416-756bc7e75590",
      "verifyUrl": "https://cursos.alura.com.br/certificate/8498ab7f-6167-48d5-a416-756bc7e75590",
      "issuerRef": "https://ulissesflores.com/#alura",
      "position": 16,
      "summary": "Professional training credential in \"RPA: aplicações gerais\" with direct verification URL.",
      "publishedAt": "2026-02-21"
    },
    {
      "slug": "alura-17-bizagi-mapeamento-com-bpmn",
      "canonicalPath": "/certifications/alura-17-bizagi-mapeamento-com-bpmn",
      "provider": "Alura",
      "name": "Bizagi: mapeamento com BPMN",
      "certId": "b45495dd-a17b-4ebb-ae03-89cf9d3fbc39",
      "verifyUrl": "https://cursos.alura.com.br/certificate/b45495dd-a17b-4ebb-ae03-89cf9d3fbc39",
      "issuerRef": "https://ulissesflores.com/#alura",
      "position": 17,
      "summary": "Professional training credential in \"Bizagi: mapeamento com BPMN\" with direct verification URL.",
      "publishedAt": "2026-02-21"
    },
    {
      "slug": "alura-18-uml-modelagem-de-diagramas",
      "canonicalPath": "/certifications/alura-18-uml-modelagem-de-diagramas",
      "provider": "Alura",
      "name": "UML: modelagem de diagramas",
      "certId": "5acd569d-4c75-47d1-b3ed-9dc51c3e6812",
      "verifyUrl": "https://cursos.alura.com.br/certificate/5acd569d-4c75-47d1-b3ed-9dc51c3e6812",
      "issuerRef": "https://ulissesflores.com/#alura",
      "position": 18,
      "summary": "Professional training credential in \"UML: modelagem de diagramas\" with direct verification URL.",
      "publishedAt": "2026-02-21"
    },
    {
      "slug": "alura-19-uml-modelagem-de-solucoes",
      "canonicalPath": "/certifications/alura-19-uml-modelagem-de-solucoes",
      "provider": "Alura",
      "name": "UML: modelagem de soluções",
      "certId": "808d0a16-fbdb-45eb-9df0-e0d6ce18213f",
      "verifyUrl": "https://cursos.alura.com.br/certificate/808d0a16-fbdb-45eb-9df0-e0d6ce18213f",
      "issuerRef": "https://ulissesflores.com/#alura",
      "position": 19,
      "summary": "Professional training credential in \"UML: modelagem de soluções\" with direct verification URL.",
      "publishedAt": "2026-02-21"
    },
    {
      "slug": "alura-20-linux-onboarding-cli-rapida-e-pratica",
      "canonicalPath": "/certifications/alura-20-linux-onboarding-cli-rapida-e-pratica",
      "provider": "Alura",
      "name": "Linux Onboarding: CLI rápida e prática",
      "certId": "7c1e8280-1f67-49e2-bf86-aa24fe674921",
      "verifyUrl": "https://cursos.alura.com.br/certificate/7c1e8280-1f67-49e2-bf86-aa24fe674921",
      "issuerRef": "https://ulissesflores.com/#alura",
      "position": 20,
      "summary": "Professional training credential in \"Linux Onboarding: CLI rápida e prática\" with direct verification URL.",
      "publishedAt": "2026-02-21"
    },
    {
      "slug": "alura-21-aprenda-java-com-orientacao-a-objetos",
      "canonicalPath": "/certifications/alura-21-aprenda-java-com-orientacao-a-objetos",
      "provider": "Alura",
      "name": "Aprenda Java com Orientação a Objetos",
      "certId": "60a265dd-c87a-4f00-91e5-c1e0680c1efc",
      "verifyUrl": "https://cursos.alura.com.br/certificate/60a265dd-c87a-4f00-91e5-c1e0680c1efc",
      "issuerRef": "https://ulissesflores.com/#alura",
      "position": 21,
      "summary": "Professional training credential in \"Aprenda Java com Orientação a Objetos\" with direct verification URL.",
      "publishedAt": "2026-02-21"
    },
    {
      "slug": "alura-22-java-criando-primeira-aplicacao",
      "canonicalPath": "/certifications/alura-22-java-criando-primeira-aplicacao",
      "provider": "Alura",
      "name": "Java: criando primeira aplicação",
      "certId": "cb6ebd04-fc02-4c2b-bb30-87e61b3796d8",
      "verifyUrl": "https://cursos.alura.com.br/certificate/cb6ebd04-fc02-4c2b-bb30-87e61b3796d8",
      "issuerRef": "https://ulissesflores.com/#alura",
      "position": 22,
      "summary": "Professional training credential in \"Java: criando primeira aplicação\" with direct verification URL.",
      "publishedAt": "2026-02-21"
    },
    {
      "slug": "alura-23-java-orientacao-a-objetos",
      "canonicalPath": "/certifications/alura-23-java-orientacao-a-objetos",
      "provider": "Alura",
      "name": "Java: Orientação a Objetos",
      "certId": "379a0ba4-997c-4cd6-90c3-c5eb8e48b3c6",
      "verifyUrl": "https://cursos.alura.com.br/certificate/379a0ba4-997c-4cd6-90c3-c5eb8e48b3c6",
      "issuerRef": "https://ulissesflores.com/#alura",
      "position": 23,
      "summary": "Professional training credential in \"Java: Orientação a Objetos\" with direct verification URL.",
      "publishedAt": "2026-02-21"
    },
    {
      "slug": "alura-24-java-listas-e-colecoes-de-dados",
      "canonicalPath": "/certifications/alura-24-java-listas-e-colecoes-de-dados",
      "provider": "Alura",
      "name": "Java: listas e coleções de dados",
      "certId": "96742210-b3e7-4fc7-8b7b-7b3d3e6e82b8",
      "verifyUrl": "https://cursos.alura.com.br/certificate/96742210-b3e7-4fc7-8b7b-7b3d3e6e82b8",
      "issuerRef": "https://ulissesflores.com/#alura",
      "position": 24,
      "summary": "Professional training credential in \"Java: listas e coleções de dados\" with direct verification URL.",
      "publishedAt": "2026-02-21"
    },
    {
      "slug": "alura-25-java-api-arquivos-e-erros",
      "canonicalPath": "/certifications/alura-25-java-api-arquivos-e-erros",
      "provider": "Alura",
      "name": "Java: API, arquivos e erros",
      "certId": "e3e64464-cc6a-43cb-8d02-ee48dc7fb75c",
      "verifyUrl": "https://cursos.alura.com.br/certificate/e3e64464-cc6a-43cb-8d02-ee48dc7fb75c",
      "issuerRef": "https://ulissesflores.com/#alura",
      "position": 25,
      "summary": "Professional training credential in \"Java: API, arquivos e erros\" with direct verification URL.",
      "publishedAt": "2026-02-21"
    },
    {
      "slug": "alura-26-c-linguagem-e-stl",
      "canonicalPath": "/certifications/alura-26-c-linguagem-e-stl",
      "provider": "Alura",
      "name": "C++: linguagem e STL",
      "certId": "2c3f2ae7-f7b4-4cc0-8862-7ff38a8b51bb",
      "verifyUrl": "https://cursos.alura.com.br/certificate/2c3f2ae7-f7b4-4cc0-8862-7ff38a8b51bb",
      "issuerRef": "https://ulissesflores.com/#alura",
      "position": 26,
      "summary": "Professional training credential in \"C++: linguagem e STL\" with direct verification URL.",
      "publishedAt": "2026-02-21"
    },
    {
      "slug": "alura-27-solid-com-php-principios-oop",
      "canonicalPath": "/certifications/alura-27-solid-com-php-principios-oop",
      "provider": "Alura",
      "name": "SOLID com PHP: princípios OOP",
      "certId": "0a1776a5-2796-4c23-b0f1-78b2a9162ef2",
      "verifyUrl": "https://cursos.alura.com.br/certificate/0a1776a5-2796-4c23-b0f1-78b2a9162ef2",
      "issuerRef": "https://ulissesflores.com/#alura",
      "position": 27,
      "summary": "Professional training credential in \"SOLID com PHP: princípios OOP\" with direct verification URL.",
      "publishedAt": "2026-02-21"
    },
    {
      "slug": "alura-28-avancando-oop-com-php",
      "canonicalPath": "/certifications/alura-28-avancando-oop-com-php",
      "provider": "Alura",
      "name": "Avançando OOP com PHP",
      "certId": "09a0fb74-75f6-44b5-8544-60585d6de6e4",
      "verifyUrl": "https://cursos.alura.com.br/certificate/09a0fb74-75f6-44b5-8544-60585d6de6e4",
      "issuerRef": "https://ulissesflores.com/#alura",
      "position": 28,
      "summary": "Professional training credential in \"Avançando OOP com PHP\" with direct verification URL.",
      "publishedAt": "2026-02-21"
    },
    {
      "slug": "alura-29-design-patterns-em-php",
      "canonicalPath": "/certifications/alura-29-design-patterns-em-php",
      "provider": "Alura",
      "name": "Design Patterns em PHP",
      "certId": "160ab564-9b24-4e0c-9f71-146a3fd571e5",
      "verifyUrl": "https://cursos.alura.com.br/certificate/160ab564-9b24-4e0c-9f71-146a3fd571e5",
      "issuerRef": "https://ulissesflores.com/#alura",
      "position": 29,
      "summary": "Professional training credential in \"Design Patterns em PHP\" with direct verification URL.",
      "publishedAt": "2026-02-21"
    },
    {
      "slug": "alura-30-orientacao-a-objetos-com-php",
      "canonicalPath": "/certifications/alura-30-orientacao-a-objetos-com-php",
      "provider": "Alura",
      "name": "Orientação a Objetos com PHP",
      "certId": "d2d1ec5d-ed0b-454a-bf0a-1db9ade28831",
      "verifyUrl": "https://cursos.alura.com.br/certificate/d2d1ec5d-ed0b-454a-bf0a-1db9ade28831",
      "issuerRef": "https://ulissesflores.com/#alura",
      "position": 30,
      "summary": "Professional training credential in \"Orientação a Objetos com PHP\" with direct verification URL.",
      "publishedAt": "2026-02-21"
    },
    {
      "slug": "alura-31-javascript-e-html-desenvolva-um-jogo",
      "canonicalPath": "/certifications/alura-31-javascript-e-html-desenvolva-um-jogo",
      "provider": "Alura",
      "name": "JavaScript e HTML: desenvolva um jogo",
      "certId": "3912a7ca-edaa-4fee-9269-500620545693",
      "verifyUrl": "https://cursos.alura.com.br/certificate/3912a7ca-edaa-4fee-9269-500620545693",
      "issuerRef": "https://ulissesflores.com/#alura",
      "position": 31,
      "summary": "Professional training credential in \"JavaScript e HTML: desenvolva um jogo\" with direct verification URL.",
      "publishedAt": "2026-02-21"
    },
    {
      "slug": "alura-32-mongodb-banco-de-dados-nosql",
      "canonicalPath": "/certifications/alura-32-mongodb-banco-de-dados-nosql",
      "provider": "Alura",
      "name": "MongoDB: banco de dados NoSQL",
      "certId": "7f84cff8-cc22-44eb-af57-906e0866c2b3",
      "verifyUrl": "https://cursos.alura.com.br/certificate/7f84cff8-cc22-44eb-af57-906e0866c2b3",
      "issuerRef": "https://ulissesflores.com/#alura",
      "position": 32,
      "summary": "Professional training credential in \"MongoDB: banco de dados NoSQL\" with direct verification URL.",
      "publishedAt": "2026-02-21"
    },
    {
      "slug": "coursera-philosophy-science-and-religion-science-and-philosophy",
      "canonicalPath": "/certifications/coursera-philosophy-science-and-religion-science-and-philosophy",
      "provider": "Coursera",
      "name": "Philosophy, Science and Religion: Science and Philosophy",
      "certId": "MYG9K9GQRP6W",
      "verifyUrl": "https://www.coursera.org/account/accomplishments/verify/MYG9K9GQRP6W",
      "issuerRef": "https://ulissesflores.com/#coursera",
      "summary": "Credential issued by Coursera for \"Philosophy, Science and Religion: Science and Philosophy\". Includes public verification URL for authenticity checks.",
      "publishedAt": "2026-02-21"
    },
    {
      "slug": "edx-ai-in-practice-preparing-for-ai",
      "canonicalPath": "/certifications/edx-ai-in-practice-preparing-for-ai",
      "provider": "edX",
      "name": "AI in Practice: Preparing for AI",
      "certId": "2f268caff8444004be14eedb309b1d9c",
      "verifyUrl": "https://courses.edx.org/certificates/2f268caff8444004be14eedb309b1d9c",
      "issuerRef": "https://ulissesflores.com/#edx",
      "summary": "Credential issued by edX for \"AI in Practice: Preparing for AI\". Includes public verification URL for authenticity checks.",
      "publishedAt": "2026-02-21"
    }
  ],
  "blog": {
    "blogUrl": "https://mundopolitico.com.br/",
    "blogSchemaId": "https://mundopolitico.com.br/#blog",
    "authorPage": "https://mundopolitico.com.br/artigos/autor/ulisses-flores",
    "inLanguage": "pt-BR",
    "canonicalPath": "/mundo-politico",
    "posts": [
      {
        "position": 1,
        "datePublished": "2026-01-15",
        "headline": "Campanha do governo Lula para reconstruir confiança no Pix: detalhes e impactos",
        "url": "https://mundopolitico.com.br/campaigno-do-governo-lula-para-reconstruir-confianca-no-pix-detalhes-e-impactos",
        "slug": "1-campanha-do-governo-lula-para-reconstruir-confianca-no-pix-detalhes-e-im",
        "canonicalPath": "/mundo-politico/1-campanha-do-governo-lula-para-reconstruir-confianca-no-pix-detalhes-e-im",
        "publishedAt": "2026-01-15",
        "summary": "Análise política publicada no portal Mundo Político em 2026-01-15, com foco em \"Campanha do governo Lula para reconstruir confiança no Pix: detalhes e impactos\"."
      },
      {
        "position": 2,
        "datePublished": "2026-01-15",
        "headline": "Conflito nas redes sociais: moderação de conteúdo vs. liberdade de expressão",
        "url": "https://mundopolitico.com.br/conflito-nas-redes-sociais-moderacao-de-conteudo-versus-liberdade-de-expressao",
        "slug": "2-conflito-nas-redes-sociais-moderacao-de-conteudo-vs-liberdade-de-express",
        "canonicalPath": "/mundo-politico/2-conflito-nas-redes-sociais-moderacao-de-conteudo-vs-liberdade-de-express",
        "publishedAt": "2026-01-15",
        "summary": "Análise política publicada no portal Mundo Político em 2026-01-15, com foco em \"Conflito nas redes sociais: moderação de conteúdo vs. liberdade de expressão\"."
      },
      {
        "position": 3,
        "datePublished": "2026-01-15",
        "headline": "Desaprovação de Lula cresce no Nordeste: mudanças na lealdade política",
        "url": "https://mundopolitico.com.br/desaprovacao-de-lula-cresce-no-nordeste-mudancas-na-lealdade-politica",
        "slug": "3-desaprovacao-de-lula-cresce-no-nordeste-mudancas-na-lealdade-politica",
        "canonicalPath": "/mundo-politico/3-desaprovacao-de-lula-cresce-no-nordeste-mudancas-na-lealdade-politica",
        "publishedAt": "2026-01-15",
        "summary": "Análise política publicada no portal Mundo Político em 2026-01-15, com foco em \"Desaprovação de Lula cresce no Nordeste: mudanças na lealdade política\"."
      },
      {
        "position": 4,
        "datePublished": "2026-01-15",
        "headline": "Pacote fiscal de Lula: expectativas e desafios para a economia brasileira",
        "url": "https://mundopolitico.com.br/pacote-fiscal-de-lula-expectativas-e-desafios-para-a-economia-brasileira-em-2023",
        "slug": "4-pacote-fiscal-de-lula-expectativas-e-desafios-para-a-economia-brasileira",
        "canonicalPath": "/mundo-politico/4-pacote-fiscal-de-lula-expectativas-e-desafios-para-a-economia-brasileira",
        "publishedAt": "2026-01-15",
        "summary": "Análise política publicada no portal Mundo Político em 2026-01-15, com foco em \"Pacote fiscal de Lula: expectativas e desafios para a economia brasileira\"."
      },
      {
        "position": 5,
        "datePublished": "2026-01-15",
        "headline": "Preservação de valores tradicionais na era da diversidade",
        "url": "https://mundopolitico.com.br/preservacao-de-valores-tradicionais-na-era-da-diversidade",
        "slug": "5-preservacao-de-valores-tradicionais-na-era-da-diversidade",
        "canonicalPath": "/mundo-politico/5-preservacao-de-valores-tradicionais-na-era-da-diversidade",
        "publishedAt": "2026-01-15",
        "summary": "Análise política publicada no portal Mundo Político em 2026-01-15, com foco em \"Preservação de valores tradicionais na era da diversidade\"."
      },
      {
        "position": 6,
        "datePublished": "2026-01-16",
        "headline": "Análise das consequências dos perdões de Trump e paralelos com o Brasil",
        "url": "https://mundopolitico.com.br/analise-das-consequencias-dos-perdoes-de-trump-e-paralelos-com-o-brasil",
        "slug": "6-analise-das-consequencias-dos-perdoes-de-trump-e-paralelos-com-o-brasil",
        "canonicalPath": "/mundo-politico/6-analise-das-consequencias-dos-perdoes-de-trump-e-paralelos-com-o-brasil",
        "publishedAt": "2026-01-16",
        "summary": "Análise política publicada no portal Mundo Político em 2026-01-16, com foco em \"Análise das consequências dos perdões de Trump e paralelos com o Brasil\"."
      },
      {
        "position": 7,
        "datePublished": "2026-01-16",
        "headline": "Discrepâncias no Brasil: análise crítica da economia e política atuais",
        "url": "https://mundopolitico.com.br/discrepancias-no-brasil-analise-critica-da-economia-e-politica-atuais",
        "slug": "7-discrepancias-no-brasil-analise-critica-da-economia-e-politica-atuais",
        "canonicalPath": "/mundo-politico/7-discrepancias-no-brasil-analise-critica-da-economia-e-politica-atuais",
        "publishedAt": "2026-01-16",
        "summary": "Análise política publicada no portal Mundo Político em 2026-01-16, com foco em \"Discrepâncias no Brasil: análise crítica da economia e política atuais\"."
      },
      {
        "position": 8,
        "datePublished": "2026-01-16",
        "headline": "Insatisfação popular cresce: como um vídeo viral no Instagram expõe gastos governamentais",
        "url": "https://mundopolitico.com.br/insatisfacao-popular-cresce-como-um-video-viral-no-instagram-explora-gastos-governamentais",
        "slug": "8-insatisfacao-popular-cresce-como-um-video-viral-no-instagram-expoe-gasto",
        "canonicalPath": "/mundo-politico/8-insatisfacao-popular-cresce-como-um-video-viral-no-instagram-expoe-gasto",
        "publishedAt": "2026-01-16",
        "summary": "Análise política publicada no portal Mundo Político em 2026-01-16, com foco em \"Insatisfação popular cresce: como um vídeo viral no Instagram expõe gastos governamentais\"."
      },
      {
        "position": 9,
        "datePublished": "2026-01-16",
        "headline": "Reforma eleitoral no Brasil: necessidade de maior transparência e comparação com os EUA",
        "url": "https://mundopolitico.com.br/reforma-eleitoral-no-brasil-a-necessidade-de-maior-transparencia-e-comparacao-com-os-eua",
        "slug": "9-reforma-eleitoral-no-brasil-necessidade-de-maior-transparencia-e-compara",
        "canonicalPath": "/mundo-politico/9-reforma-eleitoral-no-brasil-necessidade-de-maior-transparencia-e-compara",
        "publishedAt": "2026-01-16",
        "summary": "Análise política publicada no portal Mundo Político em 2026-01-16, com foco em \"Reforma eleitoral no Brasil: necessidade de maior transparência e comparação com os EUA\"."
      },
      {
        "position": 10,
        "datePublished": "2026-01-17",
        "headline": "Fiscalização do Pix: estratégia do governo Lula contra a sonegação",
        "url": "https://mundopolitico.com.br/fiscalizacao-do-pix-estrategia-do-governo-lula-contra-a-sonegacao",
        "slug": "10-fiscalizacao-do-pix-estrategia-do-governo-lula-contra-a-sonegacao",
        "canonicalPath": "/mundo-politico/10-fiscalizacao-do-pix-estrategia-do-governo-lula-contra-a-sonegacao",
        "publishedAt": "2026-01-17",
        "summary": "Análise política publicada no portal Mundo Político em 2026-01-17, com foco em \"Fiscalização do Pix: estratégia do governo Lula contra a sonegação\"."
      },
      {
        "position": 11,
        "datePublished": "2025-02-20",
        "headline": "Impacto da geopolítica nos mercados: tensões EUA–China e o futuro econômico",
        "url": "https://mundopolitico.com.br/impacto-da-geopolitica-nos-mercados-analise-das-tensoes-eua-china-e-futuro-economico",
        "slug": "11-impacto-da-geopolitica-nos-mercados-tensoes-eua-china-e-o-futuro-economi",
        "canonicalPath": "/mundo-politico/11-impacto-da-geopolitica-nos-mercados-tensoes-eua-china-e-o-futuro-economi",
        "publishedAt": "2025-02-20",
        "summary": "Análise política publicada no portal Mundo Político em 2025-02-20, com foco em \"Impacto da geopolítica nos mercados: tensões EUA–China e o futuro econômico\"."
      },
      {
        "position": 12,
        "datePublished": "2025-02-09",
        "headline": "Combate à inflação no governo Lula: estratégias e impactos nos gastos públicos",
        "url": "https://mundopolitico.com.br/combate-a-inflacao-no-governo-lula-estrategias-e-impactos-nos-gastos-publicos",
        "slug": "12-combate-a-inflacao-no-governo-lula-estrategias-e-impactos-nos-gastos-pub",
        "canonicalPath": "/mundo-politico/12-combate-a-inflacao-no-governo-lula-estrategias-e-impactos-nos-gastos-pub",
        "publishedAt": "2025-02-09",
        "summary": "Análise política publicada no portal Mundo Político em 2025-02-09, com foco em \"Combate à inflação no governo Lula: estratégias e impactos nos gastos públicos\"."
      },
      {
        "position": 13,
        "datePublished": "2025-02-18",
        "headline": "Governo Lula confronta alta dos preços de alimentos: estratégias e impactos internos",
        "url": "https://mundopolitico.com.br/governo-lula-confronta-alta-dos-precos-de-alimentos-estrategias-e-impactos-internos",
        "slug": "13-governo-lula-confronta-alta-dos-precos-de-alimentos-estrategias-e-impact",
        "canonicalPath": "/mundo-politico/13-governo-lula-confronta-alta-dos-precos-de-alimentos-estrategias-e-impact",
        "publishedAt": "2025-02-18",
        "summary": "Análise política publicada no portal Mundo Político em 2025-02-18, com foco em \"Governo Lula confronta alta dos preços de alimentos: estratégias e impactos internos\"."
      },
      {
        "position": 14,
        "datePublished": "2025-02-18",
        "headline": "Lewandowski desafia EUA sobre deportações algemadas: impacto nas relações Brasil-EUA",
        "url": "https://mundopolitico.com.br/lewandowski-desafia-eua-sobre-deportacoes-algemadas-impacto-nas-relacoes-brasil-eua",
        "slug": "14-lewandowski-desafia-eua-sobre-deportacoes-algemadas-impacto-nas-relacoes",
        "canonicalPath": "/mundo-politico/14-lewandowski-desafia-eua-sobre-deportacoes-algemadas-impacto-nas-relacoes",
        "publishedAt": "2025-02-18",
        "summary": "Análise política publicada no portal Mundo Político em 2025-02-18, com foco em \"Lewandowski desafia EUA sobre deportações algemadas: impacto nas relações Brasil-EUA\"."
      },
      {
        "position": 15,
        "datePublished": "2025-02-17",
        "headline": "Polêmica em Porto Alegre: performance de \"Jesus\" no Carnaval reacende debate",
        "url": "https://mundopolitico.com.br/polemica-em-porto-alegre-performance-de-jesus-em-carnaval-desperta-debate-sobre-liberdade-e-respeito-religioso",
        "slug": "15-polemica-em-porto-alegre-performance-de-jesus-no-carnaval-reacende-debat",
        "canonicalPath": "/mundo-politico/15-polemica-em-porto-alegre-performance-de-jesus-no-carnaval-reacende-debat",
        "publishedAt": "2025-02-17",
        "summary": "Análise política publicada no portal Mundo Político em 2025-02-17, com foco em \"Polêmica em Porto Alegre: performance de \"Jesus\" no Carnaval reacende debate\"."
      },
      {
        "position": 16,
        "datePublished": "2025-02-12",
        "headline": "Relação Brasil–EUA: impacto de Trump e Eduardo Bolsonaro na política global",
        "url": "https://mundopolitico.com.br/relacao-brasil-eua-impacto-de-trump-e-eduardo-bolsonaro-na-politica-global",
        "slug": "16-relacao-brasil-eua-impacto-de-trump-e-eduardo-bolsonaro-na-politica-glob",
        "canonicalPath": "/mundo-politico/16-relacao-brasil-eua-impacto-de-trump-e-eduardo-bolsonaro-na-politica-glob",
        "publishedAt": "2025-02-12",
        "summary": "Análise política publicada no portal Mundo Político em 2025-02-12, com foco em \"Relação Brasil–EUA: impacto de Trump e Eduardo Bolsonaro na política global\"."
      },
      {
        "position": 17,
        "datePublished": "2025-02-20",
        "headline": "Tancredo Neves e o impacto no 40º aniversário de uma transição democrática",
        "url": "https://mundopolitico.com.br/tancredo-neves-e-o-impacto-no-40o-aniversario-de-uma-transicao-democratica-no-brasil",
        "slug": "17-tancredo-neves-e-o-impacto-no-40-aniversario-de-uma-transicao-democratic",
        "canonicalPath": "/mundo-politico/17-tancredo-neves-e-o-impacto-no-40-aniversario-de-uma-transicao-democratic",
        "publishedAt": "2025-02-20",
        "summary": "Análise política publicada no portal Mundo Político em 2025-02-20, com foco em \"Tancredo Neves e o impacto no 40º aniversário de uma transição democrática\"."
      },
      {
        "position": 18,
        "datePublished": "2025-02-18",
        "headline": "Vigilância do governo Lula e liberdade de expressão: impacto no Brasil moderno",
        "url": "https://mundopolitico.com.br/vigilancia-do-governo-lula-e-liberdade-de-expressao-impacto-no-brasil-moderno",
        "slug": "18-vigilancia-do-governo-lula-e-liberdade-de-expressao-impacto-no-brasil-mo",
        "canonicalPath": "/mundo-politico/18-vigilancia-do-governo-lula-e-liberdade-de-expressao-impacto-no-brasil-mo",
        "publishedAt": "2025-02-18",
        "summary": "Análise política publicada no portal Mundo Político em 2025-02-18, com foco em \"Vigilância do governo Lula e liberdade de expressão: impacto no Brasil moderno\"."
      },
      {
        "position": 19,
        "datePublished": "2025-02-18",
        "headline": "Análise atual: impacto dos eventos históricos na política contemporânea",
        "url": "https://mundopolitico.com.br/analise-atual-impacto-dos-eventos-historicos-na-politica-contemporanea",
        "slug": "19-analise-atual-impacto-dos-eventos-historicos-na-politica-contemporanea",
        "canonicalPath": "/mundo-politico/19-analise-atual-impacto-dos-eventos-historicos-na-politica-contemporanea",
        "publishedAt": "2025-02-18",
        "summary": "Análise política publicada no portal Mundo Político em 2025-02-18, com foco em \"Análise atual: impacto dos eventos históricos na política contemporânea\"."
      }
    ]
  },
  "sermons": {
    "collectionSchemaId": "https://ulissesflores.com/#sermons",
    "publisherRef": "https://ulissesflores.com/#quadrangular-vila-helena",
    "channelUrl": "https://www.youtube.com/@quadrangularvilahelena",
    "inLanguage": "pt-BR",
    "period": "Jul 2022 – Feb 2023",
    "total": 56,
    "canonicalPath": "/sermons",
    "collections": [
      {
        "name": "Jejum da Vitória 2023 (21 devotionals)",
        "slug": "jejum-da-vitoria-2023-21-devotionals",
        "seriesSchemaId": "https://ulissesflores.com/#sermons#jejumdavitoria",
        "canonicalPath": "/sermons/jejum-da-vitoria-2023-21-devotionals",
        "items": [
          {
            "position": 1,
            "name": "Dia 1 — O Despertar da Fé",
            "datePublished": "2023-01-02",
            "youtubeUrl": "https://www.youtube.com/watch?v=NLAIyBqC4HU",
            "slug": "1-dia-1-o-despertar-da-fe",
            "canonicalPath": "/sermons/jejum-da-vitoria-2023-21-devotionals/1-dia-1-o-despertar-da-fe",
            "publishedAt": "2023-01-02",
            "summary": "Sermão \"Dia 1 — O Despertar da Fé\" da série \"Jejum da Vitória 2023 (21 devotionals)\", publicado em 2023-01-02."
          },
          {
            "position": 2,
            "name": "Dia 2 — Vencendo as Batalhas da Mente",
            "datePublished": "2023-01-03",
            "youtubeUrl": "https://www.youtube.com/watch?v=9YY1_EbBk_o",
            "slug": "2-dia-2-vencendo-as-batalhas-da-mente",
            "canonicalPath": "/sermons/jejum-da-vitoria-2023-21-devotionals/2-dia-2-vencendo-as-batalhas-da-mente",
            "publishedAt": "2023-01-03",
            "summary": "Sermão \"Dia 2 — Vencendo as Batalhas da Mente\" da série \"Jejum da Vitória 2023 (21 devotionals)\", publicado em 2023-01-03."
          },
          {
            "position": 3,
            "name": "Dia 3 — A Resiliência do Cristão",
            "datePublished": "2023-01-04",
            "youtubeUrl": "https://www.youtube.com/watch?v=UD8W6bm_nys",
            "slug": "3-dia-3-a-resiliencia-do-cristao",
            "canonicalPath": "/sermons/jejum-da-vitoria-2023-21-devotionals/3-dia-3-a-resiliencia-do-cristao",
            "publishedAt": "2023-01-04",
            "summary": "Sermão \"Dia 3 — A Resiliência do Cristão\" da série \"Jejum da Vitória 2023 (21 devotionals)\", publicado em 2023-01-04."
          },
          {
            "position": 4,
            "name": "Dia 4 — Quebrando as Muralhas Pela Oração",
            "datePublished": "2023-01-05",
            "youtubeUrl": "https://www.youtube.com/watch?v=x4C_bJBXmAE",
            "slug": "4-dia-4-quebrando-as-muralhas-pela-oracao",
            "canonicalPath": "/sermons/jejum-da-vitoria-2023-21-devotionals/4-dia-4-quebrando-as-muralhas-pela-oracao",
            "publishedAt": "2023-01-05",
            "summary": "Sermão \"Dia 4 — Quebrando as Muralhas Pela Oração\" da série \"Jejum da Vitória 2023 (21 devotionals)\", publicado em 2023-01-05."
          },
          {
            "position": 5,
            "name": "Dia 5 — O Poder da Unidade",
            "datePublished": "2023-01-06",
            "youtubeUrl": "https://www.youtube.com/watch?v=TLNNov8cBPs",
            "slug": "5-dia-5-o-poder-da-unidade",
            "canonicalPath": "/sermons/jejum-da-vitoria-2023-21-devotionals/5-dia-5-o-poder-da-unidade",
            "publishedAt": "2023-01-06",
            "summary": "Sermão \"Dia 5 — O Poder da Unidade\" da série \"Jejum da Vitória 2023 (21 devotionals)\", publicado em 2023-01-06."
          },
          {
            "position": 6,
            "name": "Dia 6 — Restituição Divina",
            "datePublished": "2023-01-07",
            "youtubeUrl": "https://www.youtube.com/watch?v=mtkDxX2XiEU",
            "slug": "6-dia-6-restituicao-divina",
            "canonicalPath": "/sermons/jejum-da-vitoria-2023-21-devotionals/6-dia-6-restituicao-divina",
            "publishedAt": "2023-01-07",
            "summary": "Sermão \"Dia 6 — Restituição Divina\" da série \"Jejum da Vitória 2023 (21 devotionals)\", publicado em 2023-01-07."
          },
          {
            "position": 7,
            "name": "Dia 7 — A Plenitude do Espírito",
            "datePublished": "2023-01-08",
            "youtubeUrl": "https://www.youtube.com/watch?v=jv0PsLg8cho",
            "slug": "7-dia-7-a-plenitude-do-espirito",
            "canonicalPath": "/sermons/jejum-da-vitoria-2023-21-devotionals/7-dia-7-a-plenitude-do-espirito",
            "publishedAt": "2023-01-08",
            "summary": "Sermão \"Dia 7 — A Plenitude do Espírito\" da série \"Jejum da Vitória 2023 (21 devotionals)\", publicado em 2023-01-08."
          },
          {
            "position": 8,
            "name": "Dia 8 — Tempo de Renovo",
            "datePublished": "2023-01-09",
            "youtubeUrl": "https://www.youtube.com/watch?v=XODx3VUZp1Y",
            "slug": "8-dia-8-tempo-de-renovo",
            "canonicalPath": "/sermons/jejum-da-vitoria-2023-21-devotionals/8-dia-8-tempo-de-renovo",
            "publishedAt": "2023-01-09",
            "summary": "Sermão \"Dia 8 — Tempo de Renovo\" da série \"Jejum da Vitória 2023 (21 devotionals)\", publicado em 2023-01-09."
          },
          {
            "position": 9,
            "name": "Dia 9 — Frutos de Uma Vida com Deus",
            "datePublished": "2023-01-10",
            "youtubeUrl": "https://www.youtube.com/watch?v=3jLWYAOdorE",
            "slug": "9-dia-9-frutos-de-uma-vida-com-deus",
            "canonicalPath": "/sermons/jejum-da-vitoria-2023-21-devotionals/9-dia-9-frutos-de-uma-vida-com-deus",
            "publishedAt": "2023-01-10",
            "summary": "Sermão \"Dia 9 — Frutos de Uma Vida com Deus\" da série \"Jejum da Vitória 2023 (21 devotionals)\", publicado em 2023-01-10."
          },
          {
            "position": 10,
            "name": "Dia 10 — Autoridade Espiritual",
            "datePublished": "2023-01-11",
            "youtubeUrl": "https://www.youtube.com/watch?v=CC4pY7oXU3w",
            "slug": "10-dia-10-autoridade-espiritual",
            "canonicalPath": "/sermons/jejum-da-vitoria-2023-21-devotionals/10-dia-10-autoridade-espiritual",
            "publishedAt": "2023-01-11",
            "summary": "Sermão \"Dia 10 — Autoridade Espiritual\" da série \"Jejum da Vitória 2023 (21 devotionals)\", publicado em 2023-01-11."
          },
          {
            "position": 11,
            "name": "Dia 11 — A Força da Palavra",
            "datePublished": "2023-01-12",
            "youtubeUrl": "https://www.youtube.com/watch?v=wiK8Ckj24XQ",
            "slug": "11-dia-11-a-forca-da-palavra",
            "canonicalPath": "/sermons/jejum-da-vitoria-2023-21-devotionals/11-dia-11-a-forca-da-palavra",
            "publishedAt": "2023-01-12",
            "summary": "Sermão \"Dia 11 — A Força da Palavra\" da série \"Jejum da Vitória 2023 (21 devotionals)\", publicado em 2023-01-12."
          },
          {
            "position": 12,
            "name": "Dia 12 — Alinhamento Profético",
            "datePublished": "2023-01-13",
            "youtubeUrl": "https://www.youtube.com/watch?v=i4pcggtnSko",
            "slug": "12-dia-12-alinhamento-profetico",
            "canonicalPath": "/sermons/jejum-da-vitoria-2023-21-devotionals/12-dia-12-alinhamento-profetico",
            "publishedAt": "2023-01-13",
            "summary": "Sermão \"Dia 12 — Alinhamento Profético\" da série \"Jejum da Vitória 2023 (21 devotionals)\", publicado em 2023-01-13."
          },
          {
            "position": 13,
            "name": "Dia 13 — Ousadia para Romper Limites",
            "datePublished": "2023-01-14",
            "youtubeUrl": "https://www.youtube.com/watch?v=PLXuFzpR6XY",
            "slug": "13-dia-13-ousadia-para-romper-limites",
            "canonicalPath": "/sermons/jejum-da-vitoria-2023-21-devotionals/13-dia-13-ousadia-para-romper-limites",
            "publishedAt": "2023-01-14",
            "summary": "Sermão \"Dia 13 — Ousadia para Romper Limites\" da série \"Jejum da Vitória 2023 (21 devotionals)\", publicado em 2023-01-14."
          },
          {
            "position": 14,
            "name": "Dia 14 — A Recompensa da Fidelidade",
            "datePublished": "2023-01-15",
            "youtubeUrl": "https://www.youtube.com/watch?v=ui-xDNtmpYw",
            "slug": "14-dia-14-a-recompensa-da-fidelidade",
            "canonicalPath": "/sermons/jejum-da-vitoria-2023-21-devotionals/14-dia-14-a-recompensa-da-fidelidade",
            "publishedAt": "2023-01-15",
            "summary": "Sermão \"Dia 14 — A Recompensa da Fidelidade\" da série \"Jejum da Vitória 2023 (21 devotionals)\", publicado em 2023-01-15."
          },
          {
            "position": 15,
            "name": "Dia 15 — Proteção e Escudo",
            "datePublished": "2023-01-16",
            "youtubeUrl": "https://www.youtube.com/watch?v=iZSbu2u0ORo",
            "slug": "15-dia-15-protecao-e-escudo",
            "canonicalPath": "/sermons/jejum-da-vitoria-2023-21-devotionals/15-dia-15-protecao-e-escudo",
            "publishedAt": "2023-01-16",
            "summary": "Sermão \"Dia 15 — Proteção e Escudo\" da série \"Jejum da Vitória 2023 (21 devotionals)\", publicado em 2023-01-16."
          },
          {
            "position": 16,
            "name": "Dia 16 — Avançando em Meio às Oposições",
            "datePublished": "2023-01-17",
            "youtubeUrl": "https://www.youtube.com/watch?v=7jXjSGKuaEs",
            "slug": "16-dia-16-avancando-em-meio-as-oposicoes",
            "canonicalPath": "/sermons/jejum-da-vitoria-2023-21-devotionals/16-dia-16-avancando-em-meio-as-oposicoes",
            "publishedAt": "2023-01-17",
            "summary": "Sermão \"Dia 16 — Avançando em Meio às Oposições\" da série \"Jejum da Vitória 2023 (21 devotionals)\", publicado em 2023-01-17."
          },
          {
            "position": 17,
            "name": "Dia 17 — Celebração Antecipada",
            "datePublished": "2023-01-18",
            "youtubeUrl": "https://www.youtube.com/watch?v=B_q2gnCx6H0",
            "slug": "17-dia-17-celebracao-antecipada",
            "canonicalPath": "/sermons/jejum-da-vitoria-2023-21-devotionals/17-dia-17-celebracao-antecipada",
            "publishedAt": "2023-01-18",
            "summary": "Sermão \"Dia 17 — Celebração Antecipada\" da série \"Jejum da Vitória 2023 (21 devotionals)\", publicado em 2023-01-18."
          },
          {
            "position": 18,
            "name": "Dia 18 — Destravando Promessas",
            "datePublished": "2023-01-19",
            "youtubeUrl": "https://www.youtube.com/watch?v=e2e_npI5Tqg",
            "slug": "18-dia-18-destravando-promessas",
            "canonicalPath": "/sermons/jejum-da-vitoria-2023-21-devotionals/18-dia-18-destravando-promessas",
            "publishedAt": "2023-01-19",
            "summary": "Sermão \"Dia 18 — Destravando Promessas\" da série \"Jejum da Vitória 2023 (21 devotionals)\", publicado em 2023-01-19."
          },
          {
            "position": 19,
            "name": "Dia 19 — O Fogo Que Não se Apaga",
            "datePublished": "2023-01-20",
            "youtubeUrl": "https://www.youtube.com/watch?v=7F2l5DD3NuM",
            "slug": "19-dia-19-o-fogo-que-nao-se-apaga",
            "canonicalPath": "/sermons/jejum-da-vitoria-2023-21-devotionals/19-dia-19-o-fogo-que-nao-se-apaga",
            "publishedAt": "2023-01-20",
            "summary": "Sermão \"Dia 19 — O Fogo Que Não se Apaga\" da série \"Jejum da Vitória 2023 (21 devotionals)\", publicado em 2023-01-20."
          },
          {
            "position": 20,
            "name": "Dia 20 — Preparando o Altar",
            "datePublished": "2023-01-21",
            "youtubeUrl": "https://www.youtube.com/watch?v=Yt7HU3NwJAw",
            "slug": "20-dia-20-preparando-o-altar",
            "canonicalPath": "/sermons/jejum-da-vitoria-2023-21-devotionals/20-dia-20-preparando-o-altar",
            "publishedAt": "2023-01-21",
            "summary": "Sermão \"Dia 20 — Preparando o Altar\" da série \"Jejum da Vitória 2023 (21 devotionals)\", publicado em 2023-01-21."
          },
          {
            "position": 21,
            "name": "Dia 21 — O Selo da Vitória",
            "datePublished": "2023-01-22",
            "youtubeUrl": "https://www.youtube.com/watch?v=qLH3tloXWXE",
            "slug": "21-dia-21-o-selo-da-vitoria",
            "canonicalPath": "/sermons/jejum-da-vitoria-2023-21-devotionals/21-dia-21-o-selo-da-vitoria",
            "publishedAt": "2023-01-22",
            "summary": "Sermão \"Dia 21 — O Selo da Vitória\" da série \"Jejum da Vitória 2023 (21 devotionals)\", publicado em 2023-01-22."
          }
        ]
      },
      {
        "name": "Cultos Online (27 services)",
        "slug": "cultos-online-27-services",
        "seriesSchemaId": "https://ulissesflores.com/#sermons#cultosonline",
        "canonicalPath": "/sermons/cultos-online-27-services",
        "items": [
          {
            "position": 1,
            "name": "Presença e Avivamento",
            "datePublished": "2022-10-30",
            "youtubeUrl": "https://www.youtube.com/watch?v=Y7A6q62VpJM",
            "slug": "1-presenca-e-avivamento",
            "canonicalPath": "/sermons/cultos-online-27-services/1-presenca-e-avivamento",
            "publishedAt": "2022-10-30",
            "summary": "Sermão \"Presença e Avivamento\" da série \"Cultos Online (27 services)\", publicado em 2022-10-30."
          },
          {
            "position": 2,
            "name": "O Chamado Inabalável — 07/08/22",
            "datePublished": "2022-08-07",
            "youtubeUrl": "https://www.youtube.com/watch?v=6fRWwVcf-k0",
            "slug": "2-o-chamado-inabalavel-07-08-22",
            "canonicalPath": "/sermons/cultos-online-27-services/2-o-chamado-inabalavel-07-08-22",
            "publishedAt": "2022-08-07",
            "summary": "Sermão \"O Chamado Inabalável — 07/08/22\" da série \"Cultos Online (27 services)\", publicado em 2022-08-07."
          },
          {
            "position": 3,
            "name": "Firmes na Promessa — 14/08/22",
            "datePublished": "2022-08-14",
            "youtubeUrl": "https://www.youtube.com/watch?v=BdLM6uzBFgI",
            "slug": "3-firmes-na-promessa-14-08-22",
            "canonicalPath": "/sermons/cultos-online-27-services/3-firmes-na-promessa-14-08-22",
            "publishedAt": "2022-08-14",
            "summary": "Sermão \"Firmes na Promessa — 14/08/22\" da série \"Cultos Online (27 services)\", publicado em 2022-08-14."
          },
          {
            "position": 4,
            "name": "A Importância da Intimidade — 18/08/2022",
            "datePublished": "2022-08-18",
            "youtubeUrl": "https://www.youtube.com/watch?v=Wc2WCYiM3Gc",
            "slug": "4-a-importancia-da-intimidade-18-08-2022",
            "canonicalPath": "/sermons/cultos-online-27-services/4-a-importancia-da-intimidade-18-08-2022",
            "publishedAt": "2022-08-18",
            "summary": "Sermão \"A Importância da Intimidade — 18/08/2022\" da série \"Cultos Online (27 services)\", publicado em 2022-08-18."
          },
          {
            "position": 5,
            "name": "Construindo Uma Vida com Propósito — 21/08/2022",
            "datePublished": "2022-08-21",
            "youtubeUrl": "https://www.youtube.com/watch?v=TyHh01KaXGw",
            "slug": "5-construindo-uma-vida-com-proposito-21-08-2022",
            "canonicalPath": "/sermons/cultos-online-27-services/5-construindo-uma-vida-com-proposito-21-08-2022",
            "publishedAt": "2022-08-21",
            "summary": "Sermão \"Construindo Uma Vida com Propósito — 21/08/2022\" da série \"Cultos Online (27 services)\", publicado em 2022-08-21."
          },
          {
            "position": 6,
            "name": "Restaurando o Altar — 25/08/2022",
            "datePublished": "2022-08-25",
            "youtubeUrl": "https://www.youtube.com/watch?v=u1v4oAamxUg",
            "slug": "6-restaurando-o-altar-25-08-2022",
            "canonicalPath": "/sermons/cultos-online-27-services/6-restaurando-o-altar-25-08-2022",
            "publishedAt": "2022-08-25",
            "summary": "Sermão \"Restaurando o Altar — 25/08/2022\" da série \"Cultos Online (27 services)\", publicado em 2022-08-25."
          },
          {
            "position": 7,
            "name": "O Agir Invisível de Deus — 28/08/2022",
            "datePublished": "2022-08-28",
            "youtubeUrl": "https://www.youtube.com/watch?v=cOZnirlxr8U",
            "slug": "7-o-agir-invisivel-de-deus-28-08-2022",
            "canonicalPath": "/sermons/cultos-online-27-services/7-o-agir-invisivel-de-deus-28-08-2022",
            "publishedAt": "2022-08-28",
            "summary": "Sermão \"O Agir Invisível de Deus — 28/08/2022\" da série \"Cultos Online (27 services)\", publicado em 2022-08-28."
          },
          {
            "position": 8,
            "name": "Atravessando Tempestades com Fé — 04/09/2022",
            "datePublished": "2022-09-04",
            "youtubeUrl": "https://www.youtube.com/watch?v=4Hg6UHYXENY",
            "slug": "8-atravessando-tempestades-com-fe-04-09-2022",
            "canonicalPath": "/sermons/cultos-online-27-services/8-atravessando-tempestades-com-fe-04-09-2022",
            "publishedAt": "2022-09-04",
            "summary": "Sermão \"Atravessando Tempestades com Fé — 04/09/2022\" da série \"Cultos Online (27 services)\", publicado em 2022-09-04."
          },
          {
            "position": 9,
            "name": "O Perdão que Liberta — 11/09/2022",
            "datePublished": "2022-09-11",
            "youtubeUrl": "https://www.youtube.com/watch?v=pTAJOi1--tY",
            "slug": "9-o-perdao-que-liberta-11-09-2022",
            "canonicalPath": "/sermons/cultos-online-27-services/9-o-perdao-que-liberta-11-09-2022",
            "publishedAt": "2022-09-11",
            "summary": "Sermão \"O Perdão que Liberta — 11/09/2022\" da série \"Cultos Online (27 services)\", publicado em 2022-09-11."
          },
          {
            "position": 10,
            "name": "Vencendo o Medo Pela Graça — 15/09/2022",
            "datePublished": "2022-09-15",
            "youtubeUrl": "https://www.youtube.com/watch?v=ariz4Xm4lks",
            "slug": "10-vencendo-o-medo-pela-graca-15-09-2022",
            "canonicalPath": "/sermons/cultos-online-27-services/10-vencendo-o-medo-pela-graca-15-09-2022",
            "publishedAt": "2022-09-15",
            "summary": "Sermão \"Vencendo o Medo Pela Graça — 15/09/2022\" da série \"Cultos Online (27 services)\", publicado em 2022-09-15."
          },
          {
            "position": 11,
            "name": "Chamados Para Fazer a Diferença — 18/09/2022",
            "datePublished": "2022-09-18",
            "youtubeUrl": "https://www.youtube.com/watch?v=4lxzEWZ4AN8",
            "slug": "11-chamados-para-fazer-a-diferenca-18-09-2022",
            "canonicalPath": "/sermons/cultos-online-27-services/11-chamados-para-fazer-a-diferenca-18-09-2022",
            "publishedAt": "2022-09-18",
            "summary": "Sermão \"Chamados Para Fazer a Diferença — 18/09/2022\" da série \"Cultos Online (27 services)\", publicado em 2022-09-18."
          },
          {
            "position": 12,
            "name": "Batismo nas águas: Nova Vida em Cristo — 25/09/2022",
            "datePublished": "2022-09-25",
            "youtubeUrl": "https://www.youtube.com/watch?v=D6pF7ZMa9UM",
            "slug": "12-batismo-nas-aguas-nova-vida-em-cristo-25-09-2022",
            "canonicalPath": "/sermons/cultos-online-27-services/12-batismo-nas-aguas-nova-vida-em-cristo-25-09-2022",
            "publishedAt": "2022-09-25",
            "summary": "Sermão \"Batismo nas águas: Nova Vida em Cristo — 25/09/2022\" da série \"Cultos Online (27 services)\", publicado em 2022-09-25."
          },
          {
            "position": 13,
            "name": "Semeando em Boa Terra — 02/10/2022",
            "datePublished": "2022-10-02",
            "youtubeUrl": "https://www.youtube.com/watch?v=Xl95QoBBQdo",
            "slug": "13-semeando-em-boa-terra-02-10-2022",
            "canonicalPath": "/sermons/cultos-online-27-services/13-semeando-em-boa-terra-02-10-2022",
            "publishedAt": "2022-10-02",
            "summary": "Sermão \"Semeando em Boa Terra — 02/10/2022\" da série \"Cultos Online (27 services)\", publicado em 2022-10-02."
          },
          {
            "position": 14,
            "name": "A Cruz e o Seu Significado Hoje — 23/10/2022",
            "datePublished": "2022-10-23",
            "youtubeUrl": "https://www.youtube.com/watch?v=kQIEbtM57Go",
            "slug": "14-a-cruz-e-o-seu-significado-hoje-23-10-2022",
            "canonicalPath": "/sermons/cultos-online-27-services/14-a-cruz-e-o-seu-significado-hoje-23-10-2022",
            "publishedAt": "2022-10-23",
            "summary": "Sermão \"A Cruz e o Seu Significado Hoje — 23/10/2022\" da série \"Cultos Online (27 services)\", publicado em 2022-10-23."
          },
          {
            "position": 15,
            "name": "Caminhando em Sobrenaturalidade — 06/11/2022",
            "datePublished": "2022-11-06",
            "youtubeUrl": "https://www.youtube.com/watch?v=YQrIOabiMoQ",
            "slug": "15-caminhando-em-sobrenaturalidade-06-11-2022",
            "canonicalPath": "/sermons/cultos-online-27-services/15-caminhando-em-sobrenaturalidade-06-11-2022",
            "publishedAt": "2022-11-06",
            "summary": "Sermão \"Caminhando em Sobrenaturalidade — 06/11/2022\" da série \"Cultos Online (27 services)\", publicado em 2022-11-06."
          },
          {
            "position": 16,
            "name": "Identidade: Quem Somos em Cristo? — 13/11/2022",
            "datePublished": "2022-11-13",
            "youtubeUrl": "https://www.youtube.com/watch?v=CJPxc-6fy04",
            "slug": "16-identidade-quem-somos-em-cristo-13-11-2022",
            "canonicalPath": "/sermons/cultos-online-27-services/16-identidade-quem-somos-em-cristo-13-11-2022",
            "publishedAt": "2022-11-13",
            "summary": "Sermão \"Identidade: Quem Somos em Cristo? — 13/11/2022\" da série \"Cultos Online (27 services)\", publicado em 2022-11-13."
          },
          {
            "position": 17,
            "name": "Cultivando um Coração Grato — 20/11",
            "datePublished": "2022-11-20",
            "youtubeUrl": "https://www.youtube.com/watch?v=kaKPhbBvo04",
            "slug": "17-cultivando-um-coracao-grato-20-11",
            "canonicalPath": "/sermons/cultos-online-27-services/17-cultivando-um-coracao-grato-20-11",
            "publishedAt": "2022-11-20",
            "summary": "Sermão \"Cultivando um Coração Grato — 20/11\" da série \"Cultos Online (27 services)\", publicado em 2022-11-20."
          },
          {
            "position": 18,
            "name": "Renovando as Forças no Altar — 27/11/2022",
            "datePublished": "2022-11-27",
            "youtubeUrl": "https://www.youtube.com/watch?v=vhFhr1Qxyw4",
            "slug": "18-renovando-as-forcas-no-altar-27-11-2022",
            "canonicalPath": "/sermons/cultos-online-27-services/18-renovando-as-forcas-no-altar-27-11-2022",
            "publishedAt": "2022-11-27",
            "summary": "Sermão \"Renovando as Forças no Altar — 27/11/2022\" da série \"Cultos Online (27 services)\", publicado em 2022-11-27."
          },
          {
            "position": 19,
            "name": "A Esperança Que Não Decepciona — 04/12/2022",
            "datePublished": "2022-12-04",
            "youtubeUrl": "https://www.youtube.com/watch?v=s5oh63j0Itc",
            "slug": "19-a-esperanca-que-nao-decepciona-04-12-2022",
            "canonicalPath": "/sermons/cultos-online-27-services/19-a-esperanca-que-nao-decepciona-04-12-2022",
            "publishedAt": "2022-12-04",
            "summary": "Sermão \"A Esperança Que Não Decepciona — 04/12/2022\" da série \"Cultos Online (27 services)\", publicado em 2022-12-04."
          },
          {
            "position": 20,
            "name": "Preparando o Coração Para o Novo Ano — 11/12/2022",
            "datePublished": "2022-12-11",
            "youtubeUrl": "https://www.youtube.com/watch?v=gkeiRaXiCMI",
            "slug": "20-preparando-o-coracao-para-o-novo-ano-11-12-2022",
            "canonicalPath": "/sermons/cultos-online-27-services/20-preparando-o-coracao-para-o-novo-ano-11-12-2022",
            "publishedAt": "2022-12-11",
            "summary": "Sermão \"Preparando o Coração Para o Novo Ano — 11/12/2022\" da série \"Cultos Online (27 services)\", publicado em 2022-12-11."
          },
          {
            "position": 21,
            "name": "Fortalecendo as Bases da Fé — 15/01/2023",
            "datePublished": "2023-01-15",
            "youtubeUrl": "https://www.youtube.com/watch?v=aSSpJn9ggaw",
            "slug": "21-fortalecendo-as-bases-da-fe-15-01-2023",
            "canonicalPath": "/sermons/cultos-online-27-services/21-fortalecendo-as-bases-da-fe-15-01-2023",
            "publishedAt": "2023-01-15",
            "summary": "Sermão \"Fortalecendo as Bases da Fé — 15/01/2023\" da série \"Cultos Online (27 services)\", publicado em 2023-01-15."
          },
          {
            "position": 22,
            "name": "O Agir do Espírito em Nossas Vidas — 22/01/2023",
            "datePublished": "2023-01-22",
            "youtubeUrl": "https://www.youtube.com/watch?v=O9HCFQI4rK4",
            "slug": "22-o-agir-do-espirito-em-nossas-vidas-22-01-2023",
            "canonicalPath": "/sermons/cultos-online-27-services/22-o-agir-do-espirito-em-nossas-vidas-22-01-2023",
            "publishedAt": "2023-01-22",
            "summary": "Sermão \"O Agir do Espírito em Nossas Vidas — 22/01/2023\" da série \"Cultos Online (27 services)\", publicado em 2023-01-22."
          },
          {
            "position": 23,
            "name": "Aprendendo a Ouvir a Voz de Deus — 29/01/2023",
            "datePublished": "2023-01-29",
            "youtubeUrl": "https://www.youtube.com/watch?v=WYOYxtc5OUM",
            "slug": "23-aprendendo-a-ouvir-a-voz-de-deus-29-01-2023",
            "canonicalPath": "/sermons/cultos-online-27-services/23-aprendendo-a-ouvir-a-voz-de-deus-29-01-2023",
            "publishedAt": "2023-01-29",
            "summary": "Sermão \"Aprendendo a Ouvir a Voz de Deus — 29/01/2023\" da série \"Cultos Online (27 services)\", publicado em 2023-01-29."
          },
          {
            "position": 24,
            "name": "Comunhão e Crescimento Espiritual — 05/02/2023",
            "datePublished": "2023-02-05",
            "youtubeUrl": "https://www.youtube.com/watch?v=t9wESfLpYrc",
            "slug": "24-comunhao-e-crescimento-espiritual-05-02-2023",
            "canonicalPath": "/sermons/cultos-online-27-services/24-comunhao-e-crescimento-espiritual-05-02-2023",
            "publishedAt": "2023-02-05",
            "summary": "Sermão \"Comunhão e Crescimento Espiritual — 05/02/2023\" da série \"Cultos Online (27 services)\", publicado em 2023-02-05."
          },
          {
            "position": 25,
            "name": "Quebrando Cadeias Invisíveis — 12/02/2023",
            "datePublished": "2023-02-12",
            "youtubeUrl": "https://www.youtube.com/watch?v=iLDmtOS8DT4",
            "slug": "25-quebrando-cadeias-invisiveis-12-02-2023",
            "canonicalPath": "/sermons/cultos-online-27-services/25-quebrando-cadeias-invisiveis-12-02-2023",
            "publishedAt": "2023-02-12",
            "summary": "Sermão \"Quebrando Cadeias Invisíveis — 12/02/2023\" da série \"Cultos Online (27 services)\", publicado em 2023-02-12."
          },
          {
            "position": 26,
            "name": "Viver em Santidade no Século XXI — 19/02/2023",
            "datePublished": "2023-02-19",
            "youtubeUrl": "https://www.youtube.com/watch?v=Dtli1GcgBKA",
            "slug": "26-viver-em-santidade-no-seculo-xxi-19-02-2023",
            "canonicalPath": "/sermons/cultos-online-27-services/26-viver-em-santidade-no-seculo-xxi-19-02-2023",
            "publishedAt": "2023-02-19",
            "summary": "Sermão \"Viver em Santidade no Século XXI — 19/02/2023\" da série \"Cultos Online (27 services)\", publicado em 2023-02-19."
          },
          {
            "position": 27,
            "name": "Festival de dança: Expressão de Adoração e Arte Profética",
            "datePublished": "2022-08-20",
            "youtubeUrl": "https://www.youtube.com/watch?v=wN4FlJtEHuY",
            "slug": "27-festival-de-danca-expressao-de-adoracao-e-arte-profetica",
            "canonicalPath": "/sermons/cultos-online-27-services/27-festival-de-danca-expressao-de-adoracao-e-arte-profetica",
            "publishedAt": "2022-08-20",
            "summary": "Sermão \"Festival de dança: Expressão de Adoração e Arte Profética\" da série \"Cultos Online (27 services)\", publicado em 2022-08-20."
          }
        ]
      },
      {
        "name": "Cultos (3 services)",
        "slug": "cultos-3-services",
        "seriesSchemaId": "https://ulissesflores.com/#sermons#cultos",
        "canonicalPath": "/sermons/cultos-3-services",
        "items": [
          {
            "position": 1,
            "name": "Restaurando o Primeiro Amor — 24/07/22",
            "datePublished": "2022-07-24",
            "youtubeUrl": "https://www.youtube.com/watch?v=rm5_xlw-JH4",
            "slug": "1-restaurando-o-primeiro-amor-24-07-22",
            "canonicalPath": "/sermons/cultos-3-services/1-restaurando-o-primeiro-amor-24-07-22",
            "publishedAt": "2022-07-24",
            "summary": "Sermão \"Restaurando o Primeiro Amor — 24/07/22\" da série \"Cultos (3 services)\", publicado em 2022-07-24."
          },
          {
            "position": 2,
            "name": "O Poder Transformador da Graça — 31/07/22",
            "datePublished": "2022-07-31",
            "youtubeUrl": "https://www.youtube.com/watch?v=SJ_8fliMJoE",
            "slug": "2-o-poder-transformador-da-graca-31-07-22",
            "canonicalPath": "/sermons/cultos-3-services/2-o-poder-transformador-da-graca-31-07-22",
            "publishedAt": "2022-07-31",
            "summary": "Sermão \"O Poder Transformador da Graça — 31/07/22\" da série \"Cultos (3 services)\", publicado em 2022-07-31."
          },
          {
            "position": 3,
            "name": "Culto regional de casais: Edificando a Família Sobre a Rocha — 03/09/2022",
            "datePublished": "2022-09-03",
            "youtubeUrl": "https://www.youtube.com/watch?v=ny5D6FRIUgo",
            "slug": "3-culto-regional-de-casais-edificando-a-familia-sobre-a-rocha-03-0",
            "canonicalPath": "/sermons/cultos-3-services/3-culto-regional-de-casais-edificando-a-familia-sobre-a-rocha-03-0",
            "publishedAt": "2022-09-03",
            "summary": "Sermão \"Culto regional de casais: Edificando a Família Sobre a Rocha — 03/09/2022\" da série \"Cultos (3 services)\", publicado em 2022-09-03."
          }
        ]
      },
      {
        "name": "Outros (5 specials)",
        "slug": "outros-5-specials",
        "seriesSchemaId": "https://ulissesflores.com/#sermons#outros",
        "canonicalPath": "/sermons/outros-5-specials",
        "items": [
          {
            "position": 1,
            "name": "Janeiro Profético: Consagrando o Novo Ano (Dia 1) — 01/01/2023",
            "datePublished": "2023-01-01",
            "youtubeUrl": "https://www.youtube.com/watch?v=YEzeDRZTkDk",
            "slug": "1-janeiro-profetico-consagrando-o-novo-ano-dia-1-01-01-2023",
            "canonicalPath": "/sermons/outros-5-specials/1-janeiro-profetico-consagrando-o-novo-ano-dia-1-01-01-2023",
            "publishedAt": "2023-01-01",
            "summary": "Sermão \"Janeiro Profético: Consagrando o Novo Ano (Dia 1) — 01/01/2023\" da série \"Outros (5 specials)\", publicado em 2023-01-01."
          },
          {
            "position": 2,
            "name": "Perseverança e Resposta (Dia 8)",
            "datePublished": "2023-01-08",
            "youtubeUrl": "https://www.youtube.com/watch?v=eUuMWxIqUFY",
            "slug": "2-perseveranca-e-resposta-dia-8",
            "canonicalPath": "/sermons/outros-5-specials/2-perseveranca-e-resposta-dia-8",
            "publishedAt": "2023-01-08",
            "summary": "Sermão \"Perseverança e Resposta (Dia 8)\" da série \"Outros (5 specials)\", publicado em 2023-01-08."
          },
          {
            "position": 3,
            "name": "O Selo Profético Para os 12 Meses de Vitória (Dia 12)",
            "datePublished": "2023-01-12",
            "youtubeUrl": "https://www.youtube.com/watch?v=eJRJDpo0V7s",
            "slug": "3-o-selo-profetico-para-os-12-meses-de-vitoria-dia-12",
            "canonicalPath": "/sermons/outros-5-specials/3-o-selo-profetico-para-os-12-meses-de-vitoria-dia-12",
            "publishedAt": "2023-01-12",
            "summary": "Sermão \"O Selo Profético Para os 12 Meses de Vitória (Dia 12)\" da série \"Outros (5 specials)\", publicado em 2023-01-12."
          },
          {
            "position": 4,
            "name": "O Grande Rompimento: Celebração dos Testemunhos (Dia 40)",
            "datePublished": "2022-09-21",
            "youtubeUrl": "https://www.youtube.com/watch?v=Y8vCcqbQgns",
            "slug": "4-o-grande-rompimento-celebracao-dos-testemunhos-dia-40",
            "canonicalPath": "/sermons/outros-5-specials/4-o-grande-rompimento-celebracao-dos-testemunhos-dia-40",
            "publishedAt": "2022-09-21",
            "summary": "Sermão \"O Grande Rompimento: Celebração dos Testemunhos (Dia 40)\" da série \"Outros (5 specials)\", publicado em 2022-09-21."
          },
          {
            "position": 5,
            "name": "Cantata de Natal: O Verbo que se Fez Carne e Habitou Entre Nós — 18/12/2022",
            "datePublished": "2022-12-18",
            "youtubeUrl": "https://www.youtube.com/watch?v=Ci0Bc1TQkN4",
            "slug": "5-cantata-de-natal-o-verbo-que-se-fez-carne-e-habitou-entre-nos-18",
            "canonicalPath": "/sermons/outros-5-specials/5-cantata-de-natal-o-verbo-que-se-fez-carne-e-habitou-entre-nos-18",
            "publishedAt": "2022-12-18",
            "summary": "Sermão \"Cantata de Natal: O Verbo que se Fez Carne e Habitou Entre Nós — 18/12/2022\" da série \"Outros (5 specials)\", publicado em 2022-12-18."
          }
        ]
      }
    ]
  }
} as const;
